Unnamed: 0.7,Unnamed: 0.6,Unnamed: 0.5,Unnamed: 0.4,Unnamed: 0.2,Unnamed: 0,Unnamed: 0.1,Unnamed: 0.1.1,Unnamed: 0.1.1.1,Unnamed: 0.1.1.1.1,Unnamed: 0.1.1.1.1.1,Unnamed: 0.1.1.1.1.1.1,Unnamed: 0.1.1.1.1.1.1.1,Unnamed: 0.1.1.1.1.1.1.1.1,source_article,updated_label,masked_articles,Unnamed: 0.3,is_fallacy 
1791,1791,1791,1791,1491,1491,1491,1491,1491,1491,1491,1494,1677,,"Charlie: I think we should put more money into schools. Quality public education is so important.  Bob: So you’re saying we should cut military spending and spend it instead on more spiral notebooks and crayons? I guess you want our country to be a weak, defenseless target for terrorists.",fallacy of extension,"MSK<0> : MSK<0> think MSK<1> should put more money into schools . Quality public education is so important . MSK<2> : So MSK<2> ’re saying MSK<1> should cut MSK<3> and spend MSK<3> instead on more spiral notebooks and crayons ? MSK<0> guess MSK<2> want MSK<1> country to be a weak , defenseless target for terrorists . ",1491.0,1
1792,1792,1792,1792,1492,1492,1492,1492,1492,1492,1492,1495,1459,,"""Every 0.008 seconds in the United States, a teen accidentally shatters his/her phone screen. You can help put an end to these devastating tragedies: donate now to my Kickstarter fund, the new Bubble-wrap Phone Case X.""",appeal to emotion,""" Every 0.008 seconds in the United States , MSK<0> accidentally shatters MSK<0> / her MSK<1> screen . You can help put an end to these devastating tragedies : donate now to my Kickstarter fund , the new Bubble - wrap MSK<1> Case X. "" ",1492.0,1
1793,1793,1793,1793,1493,1493,1493,1493,1493,1493,1493,1496,1922,,Compares minor problems with much more serious crimes,fallacy of relevance,Compares minor problems with much more serious crimes ,1493.0,1
1794,1794,1794,1794,1494,1494,1494,1494,1494,1494,1494,1497,154,,"Fred, the Australian, stole my wallet. Thus, all Australians are thieves.",faulty generalization,"Fred , the MSK<0> , stole my wallet . Thus , all MSK<0> are thieves . ",1494.0,1
1795,1795,1795,1795,1495,1495,1495,1495,1495,1495,1495,1498,600,,The news is fake because so much of the news is fake.,circular reasoning,MSK<0> is MSK<1> because so much of MSK<0> is MSK<1> . ,1495.0,1
1796,1796,1796,1796,1496,1496,1496,1496,1496,1496,1496,1499,1483,,"I ask all employees to vote for my chosen candidate in the upcoming elections. If the other candidate wins, he will raise taxes and many of you will lose your jobs.",appeal to emotion,"MSK<0> ask all employees to vote for MSK<0> in the upcoming elections . If MSK<1> MSK<3> , MSK<1> will raise taxes and many of MSK<2> will MSK<3> MSK<2> jobs . ",1496.0,1
1797,1797,1797,1797,1497,1497,1497,1497,1497,1497,1497,1500,2285,,"We haven’t proven aliens didn’t create life on earth, so aliens created life on earth.",intentional,"We have n’t proven MSK<0> did n’t MSK<2> on MSK<3> , so MSK<0> MSK<2> on MSK<3> . ",1497.0,1
1798,1798,1798,1798,1498,1498,1498,1498,1498,1498,1498,1501,1512,,"I believe that when we die, we will spend eternity reading books and learning more about writing composition. I am so comforted by this belief!",appeal to emotion,"MSK<0> MSK<2> that when MSK<1> die , MSK<1> will spend eternity reading books and learning more about writing composition . MSK<0> am so comforted by this MSK<2> ! ",1498.0,1
1799,1799,1799,1799,1499,1499,1499,1499,1499,1499,1499,1502,50,,I met a rude person from France yesterday. I guess all French people are rude.,faulty generalization,MSK<0> met a MSK<1> person from MSK<2> yesterday . MSK<0> guess all MSK<2> people are MSK<1> . ,1499.0,1
1800,1800,1800,1800,1500,1500,1500,1500,1500,1500,1500,1503,2036,,There is no intervention for victims of domestic violence that has more empirical support from controlled studies than this one. It is clear that this is the right way to address this problem and we should all be providing this therapy whenever victims of domestic violence come to us for help.,fallacy of credibility,There is no MSK<3> for MSK<0> of MSK<1> that has more empirical support from controlled studies than this one . It is clear that this is the right way to address this problem and MSK<2> should all be providing this MSK<3> whenever MSK<0> of MSK<1> come to MSK<2> for help . ,1500.0,1
1801,1801,1801,1801,1501,1501,1501,1501,1501,1501,1501,1504,1618,,"""You are either with me or against me!"" is an example of which fallacy?",false dilemma,""" You are either with MSK<0> or against MSK<0> ! "" is an example of which fallacy ? ",1501.0,1
1802,1802,1802,1802,1502,1502,1502,1502,1502,1502,1502,1505,2277,,"“We should abolish the death penalty. Many respected people, such as actor Guy Handsome, have publicly stated their opposition to it.”",fallacy of credibility,"MSK<2> We should abolish MSK<0> . MSK<1> , have publicly stated MSK<1> opposition to MSK<0> . MSK<2> ",1502.0,1
1803,1803,1803,1803,1503,1503,1503,1503,1503,1503,1503,1506,1113,,", rather than on his arguments or opinions.",ad hominem,", rather than on his arguments or opinions . ",1503.0,1
1804,1804,1804,1804,1504,1504,1504,1504,1504,1504,1504,1507,98,,"Saying things like ""ALL teenagers are irresponsible"" would be an example of which type of fallacy?",faulty generalization,"Saying things like "" ALL teenagers are irresponsible "" would be an example of which type of fallacy ? ",1504.0,1
1805,1805,1805,1805,1505,1505,1505,1505,1505,1505,1505,1508,727,,"We know God exists because we can see the perfect order of His Creation, an order which demonstrates supernatural intelligence in its design.",circular reasoning,"MSK<0> know MSK<1> exists because MSK<0> can see the perfect MSK<2> of MSK<1> Creation , an MSK<2> which demonstrates supernatural intelligence in MSK<1> design . ",1505.0,1
1806,1806,1806,1806,1506,1506,1506,1506,1506,1506,1506,1509,451,,"I broke a mirror earlier in the day, and then I received an F on my history final. Therefore, I received the F because I broke the mirror.",false causality,"MSK<0> MSK<2> earlier in the day , and then MSK<0> MSK<4> on MSK<0> history final . Therefore , MSK<0> MSK<4> because MSK<0> MSK<2> . ",1506.0,1
1807,1807,1807,1807,1507,1507,1507,1507,1507,1507,1507,1510,1168,,"during the presidential campaign of 1800, John Adams was called 'a fool, a gross hypocrite and an unprincipled oppressor.' His rival, Thomas Jefferson, on the other hand, was deemed 'an uncivilized atheist, anti-American, a tool for the godless French.'",ad hominem,"during the presidential campaign of 1800 , MSK<0> was called ' a fool , a gross hypocrite and an MSK<1> oppressor . ' MSK<0> rival , Thomas Jefferson , on the other hand , was deemed ' an MSK<1> atheist , anti-American , a tool for the godless French . ' ",1507.0,1
1808,1808,1808,1808,1508,1508,1508,1508,1508,1508,1508,1511,583,,"Lolita: Since about half the people in the world are female, the chances of the next person to walk out that door being female is about 50/50. Celina: Do you realize that is the door to Dr. Vulvastein, the gynecologist?",false causality,"Lolita : Since about half the people in the world are MSK<0> , the chances of the next person to walk out that MSK<1> being MSK<0> is about 50/50 . MSK<2> : Do MSK<2> realize that is the MSK<1> to Dr. Vulvastein , the gynecologist ? ",1508.0,1
1809,1809,1809,1809,1509,1509,1509,1509,1509,1509,1509,1512,1107,,You can't be my partner in class because you didn't donate to the Hurricane Sandy fundraiser.,ad hominem,MSK<0> can't be my partner in class because MSK<0> didn't donate to the Hurricane Sandy fundraiser . ,1509.0,1
1810,1810,1810,1810,1510,1510,1510,1510,1510,1510,1510,1513,2007,,"I saw Ashton Kutcher in a prescription drug commercial, therefore it has to be an effective drug.",fallacy of credibility,"I saw Ashton Kutcher in MSK<0> , therefore MSK<0> has to be an effective drug . ",1510.0,1
1811,1811,1811,1811,1511,1511,1511,1511,1511,1511,1511,1514,405,,"""Everytime I wash my car it rains, therefore, washing my car makes it rain.""",false causality,""" Everytime MSK<0> MSK<1> MSK<0> MSK<3> , therefore , MSK<1> MSK<0> makes MSK<3> . "" ",1511.0,1
1812,1812,1812,1812,1512,1512,1512,1512,1512,1512,1512,1515,956,,Eat lamb--could thousands of coyotes be wrong?,ad populum,Eat lamb -- could thousands of coyotes be wrong ? ,1512.0,1
1813,1813,1813,1813,1513,1513,1513,1513,1513,1513,1513,1516,694,,"""J.K Rowling is a wonderful writer because she writes so well"" is an example of what?",circular reasoning,""" MSK<0> is a wonderful writer because MSK<0> writes so well "" is an example of what ? ",1513.0,1
1814,1814,1814,1814,1514,1514,1514,1514,1514,1514,1514,1517,61,,"to define a person based on faulty opinions derived by judgments made about a group, a class, or race of people",faulty generalization,"to define a person based on faulty opinions derived by judgments made about a group , a class , or race of people ",1514.0,1
1815,1815,1815,1815,1515,1515,1515,1515,1515,1515,1515,1518,1170,,That's what you'd expect someone like him/her to say,ad hominem,That 's what you 'd expect someone like him / her to say ,1515.0,1
1816,1816,1816,1816,1516,1516,1516,1516,1516,1516,1516,1519,400,,The numbers on gun violence speak for themselves. We should ban guns in the country!,faulty generalization,MSK<0> speak for MSK<0> . We should ban guns in the country ! ,1516.0,1
1817,1817,1817,1817,1517,1517,1517,1517,1517,1517,1517,1520,162,,"One of our clients doubled their conversions after changing all their landing page text to bright red. Therefore, changing all text to red is a proven way to double conversions.",faulty generalization,"One of MSK<0> MSK<1> MSK<0> MSK<2> after MSK<4> MSK<0> . Therefore , MSK<4> is a proven way to MSK<1> MSK<2> . ",1517.0,1
1818,1818,1818,1818,1518,1518,1518,1518,1518,1518,1518,1521,1785,,"After Jhon said that we should put more money into health and education, Warren responded by saying that he was surprised that Jhon hates our country so much that he wants to leave it defenseless by cutting military spending.",fallacy of extension,"After MSK<0> said that MSK<1> should put more money into health and education , MSK<2> responded by saying that MSK<2> was surprised that MSK<0> hates MSK<1> so much that MSK<2> wants to leave coref3 defenseless by cutting military spending . ",1518.0,1
1819,1819,1819,1819,1519,1519,1519,1519,1519,1519,1519,1522,59,,"I have a red car. My car was in a wreck. Therefore, all red cars get wrecked.",faulty generalization,"coref1 have MSK<0> . MSK<0> was in a MSK<1> . Therefore , all red cars get MSK<1> . ",1519.0,1
1820,1820,1820,1820,1520,1520,1520,1520,1520,1520,1520,1523,1027,,"Billy - ""An apple is a vegetable.""  Bobby - ""Don't listen to Billy; he failed Spanish class last year. """,ad hominem,"MSK<0> - "" An apple is a vegetable . "" MSK<1> - "" Don't listen to MSK<0> ; MSK<1> failed Spanish class last year . "" ",1520.0,1
1821,1821,1821,1821,1521,1521,1521,1521,1521,1521,1521,1524,316,,"You should never gamble! Once you start gambling you find it hard to stop. Soon you will spend all your money on gambling, and eventually you will turn to crime just to support your gambling addiction.",faulty generalization,"MSK<0> should never MSK<1> ! Once MSK<0> start MSK<1> MSK<0> find it hard to stop . Soon MSK<0> will spend all MSK<0> money on MSK<2> , and eventually MSK<0> will turn to crime just to support MSK<0> MSK<2> addiction . ",1521.0,1
1822,1822,1822,1822,1522,1522,1522,1522,1522,1522,1522,1525,2232,,"Speaker 1: We should have single payer, government funded health care. That would be the best solution to the health care crisis in our country. Speaker 2: You voted for Bernie Sanders. You’re probably a communist.",ad hominem,"MSK<5> : MSK<1> should have single payer , government funded MSK<3> . That would be the best solution to the MSK<3> crisis in MSK<1> country . MSK<5> : MSK<4> voted for Bernie Sanders . MSK<4> ’re probably a communist . ",1522.0,1
1823,1823,1823,1823,1523,1523,1523,1523,1523,1523,1523,1526,676,,"Cell phones, high-tech devices that cause severe distractions and cyberbullying should be banned in schools.",circular reasoning,"Cell phones , high - tech devices that cause severe distractions and cyberbullying should be banned in schools . ",1523.0,1
1824,1824,1824,1824,1524,1524,1524,1524,1524,1524,1524,1527,1354,,"All hotdogs are fast food. No hamburgers are hotdogs. Therefore, no hamburgers are fast food.",fallacy of logic,"All MSK<0> are MSK<2> . No MSK<3> are MSK<0> . Therefore , no MSK<3> are MSK<2> . ",1524.0,1
1825,1825,1825,1825,1525,1525,1525,1525,1525,1525,1525,1528,651,,Americans should give money to charity because it is the right thing to do.,circular reasoning,Americans should give MSK<0> to charity because MSK<0> is the right thing to do . ,1525.0,1
1826,1826,1826,1826,1526,1526,1526,1526,1526,1526,1526,1529,1698,,The speaker/author chooses a deliberately (on purpose) bad or oversimplified example in order to ridicule (make fun of) or refute (prove wrong) an idea,fallacy of extension,The speaker / author chooses a deliberately ( on purpose ) bad or oversimplified example in order to ridicule ( make fun of ) or refute ( prove wrong ) an idea ,1526.0,1
1827,1827,1827,1827,1527,1527,1527,1527,1527,1527,1527,1530,509,,You know Jane Fonda’s exercise video’s must be worth the money. Look at the great shape she’s in.,false causality,You know Jane Fonda ’s exercise video ’s must be worth the money . Look at the great shape she ’s in . ,1527.0,1
1828,1828,1828,1828,1528,1528,1528,1528,1528,1528,1528,1531,523,,Families communicate less and less in the past forty years since feminism became mainstream. Feminism is to blame for this deterioration in the family.,false causality,MSK<0> communicate less and less in the past forty years since MSK<1> became mainstream . MSK<1> is to blame for this deterioration in the MSK<0> . ,1528.0,1
1829,1829,1829,1829,1529,1529,1529,1529,1529,1529,1529,1532,2258,,"If you choose not to administer triple antibiotic coverage for this patient with severe and extensive burns, you will be held responsible for any infectious complications that might eventually arise.",appeal to emotion,"If MSK<0> choose not to administer triple antibiotic coverage for this patient with severe and extensive burns , MSK<0> will be held responsible for any infectious complications that might eventually arise . ",1529.0,1
1830,1830,1830,1830,1530,1530,1530,1530,1530,1530,1530,1533,570,,"Many homosexuals have AIDS. Therefore, homosexuality causes AIDS.",false causality,"Many MSK<1> have MSK<0> . Therefore , MSK<1> causes MSK<0> . ",1530.0,1
1831,1831,1831,1831,1531,1531,1531,1531,1531,1531,1531,1534,540,,Jimmy isn’t at school today. He must be on a family trip.,false causality,MSK<0> is n’t at school today . MSK<0> must be on a family trip . ,1531.0,1
1832,1832,1832,1832,1532,1532,1532,1532,1532,1532,1532,1535,129,,"Some students who attend tutoring over the summer are not very intelligent. Since Beth attended summer tutoring, she is not a very good student.",faulty generalization,"Some MSK<0> who MSK<1> MSK<2> over the MSK<3> are not very intelligent . Since MSK<4> MSK<1> MSK<3> MSK<2> , MSK<4> is not a very good MSK<0> . ",1532.0,1
1833,1833,1833,1833,1533,1533,1533,1533,1533,1533,1533,1536,2129,,"The statement ""you are not really an American if you are vegetarian"" is an example of which fallacy?",intentional,"The statement "" MSK<0> are not really an American if MSK<0> are vegetarian "" is an example of which fallacy ? ",1533.0,1
1834,1834,1834,1834,1534,1534,1534,1534,1534,1534,1534,1537,1460,,"""I know I made a bad decision, but look at how hard I tried."" This helps manipulators to avoid taking responsibility for their actions.",appeal to emotion,""" MSK<0> know MSK<0> made a bad decision , but look at how hard MSK<0> tried . "" This helps MSK<1> to avoid taking responsibility for MSK<1> actions . ",1534.0,1
1835,1835,1835,1835,1535,1535,1535,1535,1535,1535,1535,1538,888,,Best Buy is the best electronics store because people line up outside of it on Black Friday.,ad populum,MSK<0> is the best electronics store because people line up outside of MSK<0> on Black Friday . ,1535.0,1
1836,1836,1836,1836,1536,1536,1536,1536,1536,1536,1536,1539,14,,All four year olds talk too much.,faulty generalization,All four year olds talk too much . ,1536.0,1
1837,1837,1837,1837,1537,1537,1537,1537,1537,1537,1537,1540,620,,"Pamela never lies. She told me herself, so it must be true.",circular reasoning,"MSK<0> never lies . MSK<0> told MSK<0> MSK<0> , so it must be true . ",1537.0,1
1838,1838,1838,1838,1538,1538,1538,1538,1538,1538,1538,1541,1849,,"Sure, we haven't given raises in over five years to our employees, but we work really hard to make a good product. We try to ensure the best customer service, too.",fallacy of relevance,"Sure , MSK<0> haven't given raises in over five years to MSK<0> employees , but MSK<0> work really hard to make a good product . MSK<0> try to ensure the best customer service , too . ",1538.0,1
1839,1839,1839,1839,1539,1539,1539,1539,1539,1539,1539,1542,1701,,Senator Li announced today that she plans to cut funding to early childhood education programs. The last thing we need is a government official who hates children!,fallacy of extension,MSK<0> announced today that MSK<0> plans to cut funding to early childhood education programs . The last thing we need is a government official who hates children ! ,1539.0,1
1840,1840,1840,1840,1540,1540,1540,1540,1540,1540,1540,1543,1550,,Either we ban teenagers from possessing cell phones or we continue to let thousands of young students fail their classes.,false dilemma,Either MSK<0> ban teenagers from possessing cell phones or MSK<0> continue to let MSK<1> fail MSK<1> classes . ,1540.0,1
1841,1841,1841,1841,1541,1541,1541,1541,1541,1541,1541,1544,1603,,You either support Hillary Clinton for President or you don't believe in women's rights,false dilemma,MSK<0> either support Hillary Clinton for President or MSK<0> don't believe in women 's rights ,1541.0,1
1842,1842,1842,1842,1542,1542,1542,1542,1542,1542,1542,1545,111,,Why did the blonde cross the road?  Because she saw a shoe sale!,faulty generalization,Why did the blonde cross the road ? Because she saw a shoe sale ! ,1542.0,1
1843,1843,1843,1843,1543,1543,1543,1543,1543,1543,1543,1546,677,,The President said he will not allow disrespectful dissent.,circular reasoning,MSK<0> said MSK<0> will not allow disrespectful dissent . ,1543.0,1
1844,1844,1844,1844,1544,1544,1544,1544,1544,1544,1544,1547,1135,,"We cannot listen to John’s opinion on global warming because he is a tree hugger. No podemos escuchar la opinión de John sobre el calentamiento global porque es un abrazador de árboles.",ad hominem,We can not listen to MSK<0> ’s MSK<1> on MSK<2> warming because he is a tree hugger . No podemos escuchar la MSK<1> MSK<3> MSK<0> sobre el calentamiento MSK<2> porque es un abrazador MSK<3> árboles . ,1544.0,1
1845,1845,1845,1845,1545,1545,1545,1545,1545,1545,1545,1548,468,,"""You're not feeling well because you use your phone so much.""",false causality,""" MSK<0> 're not feeling well because MSK<0> use MSK<0> phone so much . "" ",1545.0,1
1846,1846,1846,1846,1546,1546,1546,1546,1546,1546,1546,1549,1988,,"As a police officer who has worked for the city for 15 years, I have been a witness to distracted drivers and something needs to be done.",fallacy of credibility,"As a police officer who has worked for the city for 15 years , I have been a witness to distracted drivers and something needs to be done . ",1546.0,1
1847,1847,1847,1847,1547,1547,1547,1547,1547,1547,1547,1550,327,,Never be kind and generous to the poor. They’ll come to expect your help always and never learn to contribute to society.,faulty generalization,Never be kind and generous to the poor . They ’ll come to expect your help always and never learn to contribute to society . ,1547.0,1
1848,1848,1848,1848,1548,1548,1548,1548,1548,1548,1548,1551,160,,Fred the Australian stole my wallet. All Australians are thieves!,faulty generalization,MSK<0> the MSK<1> stole MSK<0> wallet . All MSK<1> are thieves ! ,1548.0,1
1849,1849,1849,1849,1549,1549,1549,1549,1549,1549,1549,1552,2442,,(Are the things being compared even similar? Does that prove anything?),fallacy of logic,( Are the things being compared even similar ? Does that prove anything ? ) ,1549.0,1
1850,1850,1850,1850,1550,1550,1550,1550,1550,1550,1550,1553,1482,,"""If you don't believe in God, you'll go to hell!"" is an example of:",appeal to emotion,""" If MSK<0> don't believe in God , MSK<0> 'll go to hell ! "" is an example of : ",1550.0,1
1851,1851,1851,1851,1551,1551,1551,1551,1551,1551,1551,1554,26,,"Jeff is preparing to create a commercial for a new energy drink. He visits a local high school and surveys students in an English class about their beverage preferences. The majority of the class says they prefer grape flavored drinks, so Jeff tells his superiors that grape is the flavor favored most by high school students. What error in reasoning has Jeff made?http://www.funtrivia.com",faulty generalization,"MSK<0> is preparing to create a commercial for a new energy MSK<1> . MSK<0> visits MSK<2> in MSK<3> . The majority of MSK<3> says MSK<2> prefer MSK<4> MSK<5> MSK<1> , so MSK<0> tells MSK<0> superiors that MSK<4> is the MSK<5> favored most by high school students . What error in reasoning has Jeff made?http : / / www.funtrivia.com ",1551.0,1
1852,1852,1852,1852,1552,1552,1552,1552,1552,1552,1552,1555,2342,,"If the ozone layer is destroyed, many people will get cancer and suffer from other illnesses.  The ozone layer is being protected, not destroyed.  So, many people will be spared the pain of cancer and other illnesses.",fallacy of logic,"If MSK<0> is MSK<1> , many MSK<2> will get MSK<3> and suffer from other MSK<4> . MSK<0> is being protected , not MSK<1> . So , many MSK<2> will be spared the pain of MSK<3> and other MSK<4> . ",1552.0,1
1853,1853,1853,1853,1553,1553,1553,1553,1553,1553,1553,1556,1577,,"Look, you are going to have to make up your mind. Either you decide that you can afford this stereo, or you decide you are going to do without music for a while.",false dilemma,"Look , MSK<0> are going to have to make up MSK<0> mind . Either MSK<0> MSK<1> that MSK<0> can afford this stereo , or MSK<0> MSK<1> MSK<0> are going to do without music for a while . ",1553.0,1
1854,1854,1854,1854,1554,1554,1554,1554,1554,1554,1554,1557,1720,,Caroline says that she is going to have lunch with the new girl. Jenna says that she can't believe that Caroline is ditching her old friends for the new girl.,fallacy of extension,MSK<0> says that MSK<0> is going to have lunch with MSK<1> . MSK<0> says that MSK<0> can't believe that MSK<0> is ditching MSK<0> old friends for MSK<1> . ,1554.0,1
1855,1855,1855,1855,1555,1555,1555,1555,1555,1555,1555,1558,1635,,"If you don't pay taxes, you don't deserve the right to vote.",false dilemma,"If MSK<0> don't pay taxes , MSK<0> don't deserve the right to vote . ",1555.0,1
1856,1856,1856,1856,1556,1556,1556,1556,1556,1556,1556,1559,2073,,"We don't know for sure that phones lower students' success levels, so there's no need to ban them.",intentional,"We don't know for sure that MSK<0> success levels , so there 's no need to ban MSK<0> . ",1556.0,1
1857,1857,1857,1857,1557,1557,1557,1557,1557,1557,1557,1560,1992,,SM 10: Local talk show host saying we are on the verge of a nuclear war leading to sitting in a basement for months.,fallacy of credibility,SM 10 : Local talk show host saying we are on the verge of a nuclear war leading to sitting in a basement for months . ,1557.0,1
1858,1858,1858,1858,1558,1558,1558,1558,1558,1558,1558,1561,901,,Killing thousands of people as a result of drug war campaign is not a crime to humanity because millions of Filipino support it.,ad populum,Killing MSK<1> of people as a result of MSK<0> is not a crime to humanity because MSK<1> of Filipino support MSK<0> . ,1558.0,1
1859,1859,1859,1859,1559,1559,1559,1559,1559,1559,1559,1562,1073,,"""I see no reason to listen to Smith. Anything he says will be influenced by his interest in civil rights. His statements are bound to be distorted and unreliable.""  What logical fallacy is used in the statement above?",ad hominem,""" I see no reason to listen to MSK<0> . Anything MSK<0> says will be influenced by MSK<0> interest in civil rights . MSK<0> MSK<1> are bound to be distorted and unreliable . "" What logical fallacy is used in the MSK<1> above ? ",1559.0,1
1860,1860,1860,1860,1560,1560,1560,1560,1560,1560,1560,1563,885,,"""Chick-Fil-A is the greatest food chain in existence. Look at the crowds!""",ad populum,""" Chick - Fil - A is the greatest food chain in existence . Look at the crowds ! "" ",1560.0,1
1861,1861,1861,1861,1561,1561,1561,1561,1561,1561,1561,1564,1463,,You've got to donate to the hockey team. They are helping build schools in Uganda. Imagine all of those poor and hungry kids there.,appeal to emotion,You 've got to donate to the hockey team . They are helping build schools in Uganda . Imagine all of those poor and hungry kids there . ,1561.0,1
1862,1862,1862,1862,1562,1562,1562,1562,1562,1562,1562,1565,2086,,"""If you believe that I am wrong, prove to me that I am.""",intentional,""" If you believe that MSK<0> am wrong , prove to MSK<0> that MSK<0> am . "" ",1562.0,1
1863,1863,1863,1863,1563,1563,1563,1563,1563,1563,1563,1566,848,,This movie was #1 at the box office last weekend! That means it must be really good!,ad populum,MSK<0> was MSK<1> at the box office last weekend ! MSK<1> means MSK<0> must be really good ! ,1563.0,1
