Unnamed: 0.7,Unnamed: 0.6,Unnamed: 0.5,Unnamed: 0.4,Unnamed: 0.2,Unnamed: 0,Unnamed: 0.1,Unnamed: 0.1.1,Unnamed: 0.1.1.1,Unnamed: 0.1.1.1.1,Unnamed: 0.1.1.1.1.1,Unnamed: 0.1.1.1.1.1.1,Unnamed: 0.1.1.1.1.1.1.1,Unnamed: 0.1.1.1.1.1.1.1.1,source_article,updated_label,masked_articles,Unnamed: 0.3,is_fallacy 
0,0,0,0,0,0,0,0,0,0,0,0,0,1738.0,People who drive big cars probably hate the environment.,fallacy of extension,People who drive big cars probably hate the environment . ,,1
1,1,1,1,1,1,1,1,1,1,1,1,1,168.0,"White men can't jump. No, really, they can't!",faulty generalization,"MSK<0> can't jump . No , really , MSK<0> can't ! ",,1
2,2,2,2,2,2,2,2,2,2,2,2,2,1331.0,"'Cotton and grain crops were lower this year than last. So, people must be stealing them."" This is an example of what kind of logical fallacy?",fallacy of logic,"' Cotton and grain crops were lower this year than last . So , MSK<0> must be stealing MSK<0> . "" This is an example of what kind of logical fallacy ? ",,1
3,3,3,3,3,3,3,3,3,3,3,3,3,449.0,"""Why are you hitting your computer!?"" ""The last time my wifi was weak, I hit my computer and it got better."" What is this?",false causality,""" Why are MSK<0> MSK<1> MSK<0> !? "" "" The last time MSK<2> was weak , MSK<2> MSK<1> coref1 and coref3 got better . "" What is this ? ",,1
4,4,4,4,4,4,4,4,4,4,4,4,4,130.0,All students are good and all clowns are bad.,faulty generalization,All students are good and all clowns are bad . ,,1
5,5,5,5,5,5,5,5,5,5,5,5,5,1747.0,"""People who don't support the proposed state minimum wage increase must hate the poor so much.""  Which logical fallacy is used in the statement above?",fallacy of extension,""" People who don't support the proposed state minimum wage increase must hate the poor so much . "" Which logical fallacy is used in the statement above ? ",,1
6,6,6,6,6,6,6,6,6,6,6,6,6,1688.0,"Charlie: Illegal posting and sharing of songs online is crippling the music industry. Bob: You couldn't be more wrong; the music industry is doing just fine! I can't believe you think the government should be allowed to regulate what I share with my friends. No one wants a world where I can't loan a book to my girlfriend, let my roommate borrow my iPod, or share a funny meme with my blog followers.",fallacy of extension,"Charlie : Illegal posting and MSK<2> of songs online is crippling MSK<0> . MSK<1> : MSK<1> couldn't be more wrong ; MSK<0> is doing just fine ! MSK<1> can't believe MSK<1> think the government should be allowed to regulate what MSK<1> MSK<2> with MSK<1> friends . No one wants a world where MSK<1> can't loan a book to MSK<1> girlfriend , let MSK<1> roommate borrow MSK<1> iPod , or MSK<2> a funny meme with MSK<1> blog followers . ",,1
7,7,7,7,7,7,7,7,7,7,7,7,7,361.0,"Paige wants to play a guitar solo on our next recording. Her father is a horrible musician, though, so I doubt that Paula's any good either.",faulty generalization,"MSK<0> wants to play a guitar solo on our next recording . MSK<0> father is a horrible musician , though , so I doubt that Paula 's any good either . ",,1
8,8,8,8,8,8,8,8,8,8,8,8,8,1964.0,"My sister-in-law, who is a teacher, said that this school is not somewhere that I would want to send my children.",fallacy of credibility,"MSK<0> sister - in - law , who is a teacher , said that this school is not somewhere that MSK<0> would want to send MSK<0> children . ",,1
9,9,9,9,9,9,9,9,9,9,9,9,9,737.0,something that kills is deadly,circular reasoning,something that kills is deadly ,,1
10,10,10,10,10,10,10,10,10,10,10,10,10,423.0,"“The rooster crows always before the sun rises, therefore the crowing rooster causes the sun to rise.”",false causality,"MSK<3> MSK<0> crows always before MSK<1> MSK<2> , therefore MSK<0> causes MSK<1> to MSK<2> . MSK<3> ",,1
11,11,11,11,11,11,11,11,11,11,11,11,11,67.0,1 = a number; 2 = a number; therefore 1 = 2.,faulty generalization,MSK<0> = a MSK<1> ; MSK<0> = a MSK<1> ; therefore MSK<0> = MSK<0> . ,,1
12,12,12,12,12,12,12,12,12,12,12,12,12,1111.0,“against the man;” attacking the individual rather than their position.,ad hominem,MSK<0> against the man ; MSK<0> attacking the individual rather than their position . ,,1
13,13,13,13,13,13,13,13,13,13,13,13,13,856.0,"Makes the claim that EVERYONE is using this product, and you should, too.",ad populum,"Makes the claim that EVERYONE is using this product , and you should , too . ",,1
14,14,14,14,14,14,14,14,14,14,14,14,14,101.0,I can't trust the mayor or the governor. All politicians must be liars.,faulty generalization,I can't trust the mayor or the governor . All politicians must be liars . ,,1
15,15,15,15,15,15,15,15,15,15,15,15,15,2124.0,"""I'm French and I don't like cheese."" ""All French like cheese."" ""I don't."" ""Then you must not really be French.""",intentional,""" MSK<0> 'm MSK<1> and MSK<0> don't MSK<3> . "" "" All MSK<1> MSK<3> . "" "" MSK<0> don't . "" "" Then you must not really be MSK<1> . "" ",,1
16,16,16,16,16,16,16,16,16,16,16,16,16,799.0,Everyone is going to get the new smart phone when it comes out this weekend. Why aren’t you?,ad populum,Everyone is going to get MSK<0> when MSK<0> comes out this weekend . Why are n’t you ? ,,1
17,17,17,17,17,17,17,17,17,17,17,17,17,1281.0,Encampment is like basic training. It’s CAP’s equivalent to Boot Camp.,fallacy of logic,MSK<0> is like basic training . MSK<0> ’s CAP ’s equivalent to Boot Camp . ,,1
18,18,18,18,18,18,18,18,18,18,18,18,18,973.0,We cannot listen to John’s opinion on global warming because he is a tree hugger.,ad hominem,We can not listen to John ’s opinion on global warming because he is a tree hugger . ,,1
19,19,19,19,19,19,19,19,19,19,19,19,19,2118.0,Kerry’s plan will raise taxes by at least $900 billion his first hundred days.,intentional,Kerry ’s plan will raise taxes by at least $ 900 billion his first hundred days . ,,1
20,20,20,20,20,20,20,20,20,20,20,20,20,609.0,Repeating the same thing as if you’re proving something,circular reasoning,Repeating the same thing as if you ’re proving something ,,1
21,21,21,21,21,21,21,21,21,21,21,21,21,820.0,"""I'm gonna get an iPhone because everybody else has an iPhone and they're cool.""",ad populum,""" I 'm gon na get MSK<0> because MSK<1> has MSK<0> and MSK<1> 're cool . "" ",,1
22,22,22,22,22,22,22,22,22,22,22,22,22,1917.0,"""Russia has a terrible human rights record."" ""Well, the United States has done plenty of bad things, but we aren't a bad country, so Russia isn't, either."" -the President when confronted about Russia's human rights abuses.",fallacy of relevance,""" MSK<0> has a MSK<3> MSK<2> record . "" "" Well , the United States has done plenty of MSK<3> things , but we aren't a MSK<3> country , so MSK<0> isn't , either . "" - the President when confronted about MSK<0> MSK<2> abuses . ",,1
23,23,23,23,23,23,23,23,23,23,23,23,23,642.0,"""The Philippines is in poverty because of poor people.""",circular reasoning,""" The Philippines is in poverty because of poor people . "" ",,1
24,24,24,24,24,24,24,24,24,24,24,24,24,1763.0,"Thomas: ""Dating apps are an effective way to meet potential dates. With people's busy work schedules nowadays, technology can help you make connections."" Nina: ""Dating apps are dangerous! Most people are catfished, and guys usually pretend to be so much better than they really are online. If we're so busy, we won't have time for any of that, anyway."" What fallacy is Nina leaning toward?",fallacy of extension,"Thomas : "" MSK<0> MSK<1> are an effective way to meet potential MSK<0> . With MSK<2> 's MSK<3> work schedules nowadays , technology can help you make connections . "" MSK<4> : "" MSK<0> MSK<1> are dangerous ! Most MSK<2> are catfished , and MSK<5> usually pretend to be so much better than MSK<5> really are online . If MSK<6> 're so MSK<3> , MSK<6> won't have time for any of that , anyway . "" What fallacy is MSK<4> leaning toward ? ",,1
25,25,25,25,25,25,25,25,25,25,25,25,25,1865.0,"""My opponent claims that water pollution is endangering our city waters. But have you thought about all of the air pollution in China? Where they have to wear masks sometimes in the city? That's what we really need to worry about.""",fallacy of relevance,""" My opponent claims that MSK<0> is endangering our MSK<1> waters . But have you thought about all of MSK<0> in China ? Where they have to wear masks sometimes in the MSK<1> ? That 's what we really need to worry about . "" ",,1
26,26,26,26,26,26,26,26,26,26,26,26,26,1049.0,"""You're a Westener and you're an idiot.""",ad hominem,""" MSK<0> 're a Westener and MSK<0> 're an idiot . "" ",,1
27,27,27,27,27,27,27,27,27,27,27,27,27,1162.0,Researchers are frauds who don’t earn their salaries,ad hominem,MSK<0> are frauds who do n’t earn MSK<0> salaries ,,1
28,28,28,28,28,28,28,28,28,28,28,28,28,47.0,The child did not do his chores so therefore all children are lazy.,faulty generalization,MSK<0> did not do MSK<0> chores so therefore all children are lazy . ,,1
29,29,29,29,29,29,29,29,29,29,29,29,29,1189.0,"Having come from the same political party, he is sure to communicate biased and untrue claims about his party-mates",ad hominem,"Having come from the same political MSK<0> , MSK<1> is sure to communicate biased and untrue claims about MSK<1> MSK<0> - mates ",,1
30,30,30,30,30,30,30,30,30,30,30,30,30,196.0,I would never buy a Buick. My father owned two of them and both of them had frequent transmission problems. Buicks obviously break down all the time.,faulty generalization,MSK<0> would never buy a MSK<1> . MSK<0> father owned two of MSK<2> and both of MSK<2> had frequent transmission problems . MSK<1> obviously break down all the time . ,,1
31,31,31,31,31,31,31,31,31,31,31,31,31,661.0,"“We must accept the traditions of the men of old time who affirm themselves to be the offspring of the gods - that is what they say - and they must surely have known their own ancestors. How can we doubt the word of the children of the gods?” - Plato, Timaeus",circular reasoning,"MSK<3> MSK<0> must accept the traditions of the men of old time who affirm themselves to be the offspring of MSK<1> - that is what MSK<2> say - and MSK<2> must surely have known MSK<2> own ancestors . How can MSK<0> doubt the word of the children of MSK<1> ? MSK<3> - Plato , Timaeus ",,1
32,32,32,32,32,32,32,32,32,32,32,32,32,708.0,Has your psychology department stopped teaching that ineffective approach to therapy yet?,circular reasoning,Has your psychology department stopped teaching that ineffective approach to therapy yet ? ,,1
33,33,33,33,33,33,33,33,33,33,33,33,33,2030.0,"Bill: Hey, did you hear we have a new operating system out now?  It is better than anything else out there because we just released it! Steve: What’s it called? Bill: Windows Vista! Steve: Sounds wonderful!  I can’t wait until all of your users install it on all their computers! ",fallacy of credibility,"MSK<0> : Hey , did MSK<0> hear MSK<1> have a new operating system out now ? MSK<2> is better than anything else out there because MSK<1> just released MSK<2> ! MSK<3> : What ’s MSK<2> called ? MSK<0> : Windows Vista ! MSK<3> : Sounds wonderful ! I ca n’t wait until MSK<4> MSK<0> install MSK<2> on all MSK<4> computers ! ",,1
34,34,34,34,34,34,34,34,34,34,34,34,34,1491.0,It takes faith to believe in God just like it takes faith to believe in the Easter Bunny -- but at least the Easter Bunny is based on a creature that actually exists!,appeal to emotion,MSK<0> takes MSK<1> to MSK<2> in God just like MSK<0> takes MSK<1> to MSK<2> in MSK<3> -- but at least MSK<3> is based on a creature that actually exists ! ,,1
35,35,35,35,35,35,35,35,35,35,35,35,35,1888.0,"When asked about his comments Trump made on his tape with Billy Bush, Trump responded, “It’s locker room talk, and it’s one of those things. I will knock the hell out of ISIS. We’re going to defeat ISIS. ISIS happened a number of years ago in a vacuum that was left because of bad judgment. And I will tell you, I will take care of ISIS.”",fallacy of relevance,"When asked about MSK<0> comments MSK<0> made on MSK<0> tape with Billy Bush , MSK<0> responded , MSK<4> MSK<1> ’s locker room talk , and MSK<1> ’s one of those things . MSK<2> will knock the hell out of MSK<3> . We ’re going to defeat MSK<3> . MSK<3> happened a number of years ago in a vacuum that was left because of bad judgment . And MSK<2> will tell you , MSK<2> will take care of MSK<3> . MSK<4> ",,1
36,36,36,36,36,36,36,36,36,36,36,36,36,510.0,"""Truly helps cramming for a test: my psychological test is crowded and I have an A.""",false causality,""" Truly helps cramming for a MSK<0> : MSK<1> psychological MSK<0> is crowded and MSK<1> have an A. "" ",,1
37,37,37,37,37,37,37,37,37,37,37,37,37,876.0,"assumes that if many people act or believe a certain way, it must be the right way",ad populum,"assumes that if many people act or believe a certain MSK<0> , it must be the right MSK<0> ",,1
38,38,38,38,38,38,38,38,38,38,38,38,38,120.0,"We should go inside; the last time the clouds were that dark, there was a tornado.",faulty generalization,"We should go inside ; the last time the clouds were that dark , there was a tornado . ",,1
39,39,39,39,39,39,39,39,39,39,39,39,39,781.0,Everyone is/is not doing it! It must/must not be a good thing!,ad populum,Everyone is / is not doing MSK<0> ! MSK<0> must / must not be a good thing ! ,,1
40,40,40,40,40,40,40,40,40,40,40,40,40,1969.0,"An ad claims that 3 out of 4 real estate agents reccommend moving to Sunnyville, California.",fallacy of credibility,"An ad claims that MSK<0> out of MSK<0> real estate agents reccommend moving to Sunnyville , California . ",,1
41,41,41,41,41,41,41,41,41,41,41,41,41,2149.0,Have you stopped cheating on tests?  To answer yes means you cheated before. To answer no means you continue to cheat.,intentional,Have MSK<0> stopped MSK<1> on tests ? To MSK<2> yes means MSK<0> MSK<1> before . To MSK<2> no means MSK<0> continue to MSK<1> . ,,1
42,42,42,42,42,42,42,42,42,42,42,42,42,1059.0,"""You're too ugly to be class president!""",ad hominem,""" You 're too ugly to be class president ! "" ",,1
43,43,43,43,43,43,43,43,43,43,43,43,43,2156.0,"Why should merely cracking down on terrorism help to stop it, when that method hasn't worked in any other country?",intentional,"Why should merely cracking down on terrorism help to stop it , when that method hasn't worked in any other country ? ",,1
44,44,44,44,44,44,44,44,44,44,44,44,44,822.0,40 million people can't be wrong! Buy the new Iphone XIV today!,ad populum,40 million people can't be wrong ! Buy the new Iphone XIV today ! ,,1
45,45,45,45,45,45,45,45,45,45,45,45,45,1470.0,"If you love your family, you'll buy this new stealth security system.",appeal to emotion,"If MSK<0> love MSK<0> family , MSK<0> 'll buy this new stealth security system . ",,1
46,46,46,46,46,46,46,46,46,46,46,46,46,2154.0,How many school shootings should we tolerate before we change the gun laws?,intentional,How many school shootings should MSK<0> tolerate before MSK<0> change the gun laws ? ,,1
47,47,47,47,47,47,47,47,47,47,47,47,47,1175.0,President Trump said that he was proud of the children who participated in this year's Special Olympics. Those kids are a bunch of losers.,ad hominem,MSK<0> said that MSK<0> was proud of the MSK<1> who participated in this year 's Special Olympics . Those MSK<1> are a bunch of losers . ,,1
48,48,48,48,48,48,48,48,48,48,48,48,48,2011.0,Our competitors use unhealthy sugar substitutes and artificial sweeteners. But Rev-Up Energy Drink contains one hundred percent real cane sugar to fuel your body better.,fallacy of credibility,Our competitors use unhealthy MSK<0> substitutes and artificial MSK<0> . But Rev - Up Energy Drink contains one hundred percent real cane MSK<0> to fuel your body better . ,,1
49,49,49,49,49,49,49,49,49,49,49,49,49,2247.0,"It’s possible to pass the class without attending regularly. Therefore, you will pass even if you don’t attend regularly.",fallacy of logic,"It ’s possible to MSK<0> the class without MSK<2> . Therefore , MSK<3> will MSK<0> even if MSK<3> do n’t MSK<2> . ",,1
50,50,50,50,50,50,50,50,50,50,50,50,50,650.0,"""I shouldn't have flunked the test because I never get F's"" is an example of",circular reasoning,""" MSK<0> shouldn't have flunked the test because MSK<0> never get F 's "" is an example of ",,1
51,51,51,51,51,51,51,51,51,51,51,51,51,230.0,"If I don't take this AP class, then I won't do well on the exam. If I don't do well on the AP exam, then I won't get into a good college. If I can't get into a good college, then I'll never get a good job. If I can't get a good job, then I'm going to have to live in my parents' basement forever. Guess I'll sign up for the AP class...",faulty generalization,"If MSK<0> don't take MSK<1> , then MSK<0> won't do well on the MSK<2> . If MSK<0> don't do well on the AP MSK<2> , then MSK<0> won't get into a MSK<4> . If MSK<0> can't get into a MSK<4> , then MSK<0> 'll never get MSK<5> . If MSK<0> can't get MSK<5> , then MSK<0> 'm going to have to live in MSK<0> parents ' basement forever . Guess MSK<0> 'll sign up for MSK<1> ... ",,1
52,52,52,52,52,52,52,52,52,52,52,52,52,2255.0,I can’t take home a B in this course. My parents will be angry with me.,appeal to emotion,MSK<0> ca n’t take home a B in this course . MSK<0> parents will be angry with MSK<0> . ,,1
53,53,53,53,53,53,53,53,53,53,53,53,53,2423.0,I don't see how you can say you're an ethical person. It's so hard to get you to do anything; your work ethic is so bad,equivocation,I don't see how MSK<0> can say MSK<0> 're an ethical person . It 's so hard to get MSK<0> to do anything ; MSK<0> work ethic is so bad ,,1
54,54,54,54,54,54,54,54,54,54,54,54,54,1869.0,"I don't think that there should be marriage among homosexuals. Anyway, taxes on married people are high. I think that taxes on the married are just ridiculous.",fallacy of relevance,"MSK<0> don't MSK<1> that there should be marriage among homosexuals . Anyway , MSK<2> on MSK<3> people are high . MSK<0> MSK<1> that MSK<2> on the MSK<3> are just ridiculous . ",,1
55,55,55,55,55,55,55,55,55,55,55,55,55,692.0,"""We need to fix our broken judicial system by electing new people."" This logical fallacy is called...",circular reasoning,""" MSK<0> need to fix MSK<0> broken judicial system by electing new people . "" This logical fallacy is called ... ",,1
56,56,56,56,56,56,56,56,56,56,56,56,56,2101.0,"Audrey: I am a human being. I am not a cyborg from the future here to destroy humanity. Fred: Prove that you are human! Cyborgs don't pass out when they lose a lot of blood. Here's a knife. Audrey: Get to bed, Freddie. And no more SYFY channel before bed! ",intentional,"MSK<0> : MSK<1> am a MSK<2> being . MSK<1> am not a cyborg from the future here to destroy humanity . Fred : Prove that you are MSK<2> ! MSK<3> don't pass out when MSK<3> lose a lot of blood . Here 's a knife . MSK<0> : Get to MSK<4> , Freddie . And no more SYFY channel before MSK<4> ! ",,1
57,57,57,57,57,57,57,57,57,57,57,57,57,228.0,"If you don't study, you'll fail your test. Then you will do poorly in the class and you GPA will fall. You won't get into a good college, so you'll never get a decent job and you'll end up poor and homeless.",faulty generalization,"If MSK<0> don't study , MSK<0> 'll fail MSK<0> test . Then MSK<0> will do poorly in the class and MSK<0> GPA will fall . MSK<0> won't get into a good college , so MSK<0> 'll never get a decent job and MSK<0> 'll end up poor and homeless . ",,1
58,58,58,58,58,58,58,58,58,58,58,58,58,202.0,"I know for a fact that ghosts exist. My friend, who is a very reliable person, has seen ghosts on many occasions.",faulty generalization,"MSK<0> know for a fact that MSK<1> exist . MSK<0> friend , who is a very reliable person , has seen MSK<1> on many occasions . ",,1
59,59,59,59,59,59,59,59,59,59,59,59,59,1533.0,"If you don't say the Pledge of Allegiance, then you must be a traitor.",false dilemma,"If MSK<0> don't say the Pledge of Allegiance , then MSK<0> must be a traitor . ",,1
60,60,60,60,60,60,60,60,60,60,60,60,60,1253.0,Not believing in the Tooth Fairy is like denying that the Titanic sank because eye-witnesses did not agree if the ship broke in half before or after it sank.,fallacy of logic,Not believing in the Tooth Fairy is like denying that the Titanic MSK<0> because eye - witnesses did not agree if MSK<1> broke in half before or after MSK<1> MSK<0> . ,,1
61,61,61,61,61,61,61,61,61,61,61,61,61,110.0,"All of my red-headed friends are good dancers. Therefore, all red-headed people must be good dancers.  This assumption from my experience is an example of",faulty generalization,"All of MSK<0> MSK<1> - MSK<2> friends are MSK<4> . Therefore , all MSK<1> - MSK<2> people must be MSK<4> . This assumption from MSK<0> experience is an example of ",,1
62,62,62,62,62,62,62,62,62,62,62,62,62,1002.0,"Louise is running for class president. In her campaign speech she says, ""My opponent does not deserve to win. She is a smoker and she cheated on her boyfriend last year."" What fallacy has Louise committed? http://www.funtrivia.com",ad hominem,"MSK<0> is running for class president . In MSK<0> campaign speech MSK<0> says , "" MSK<0> opponent does not deserve to win . MSK<0> is a smoker and MSK<0> cheated on MSK<0> boyfriend last year . "" What fallacy has MSK<0> committed ? http://www.funtrivia.com ",,1
63,63,63,63,63,63,63,63,63,63,63,63,63,1594.0,"Dana is trying to raise money for her university's library. In her address to the board of trustees, she says, ""We must raise tuition to cover the cost of new books. Otherwise the library will be forced to close.""  Of what fallacy is this an example?",false dilemma,"MSK<0> is trying to MSK<1> money for MSK<0> . In MSK<0> address to the board of trustees , MSK<0> says , "" We must MSK<1> tuition to cover the cost of new books . Otherwise coref1 will be forced to close . "" Of what fallacy is this an example ? ",,1
64,64,64,64,64,64,64,64,64,64,64,64,64,2096.0,"Jack: I have tiny, invisible unicorns living in my anus.  Nick: How do you figure?  Jack: Can you prove that I don't?  Nick: No.  Jack: Then I do.",intentional,"MSK<0> : MSK<1> have tiny , invisible unicorns living in MSK<1> anus . MSK<2> : How do MSK<2> figure ? MSK<0> : Can MSK<2> prove that MSK<1> don't ? MSK<2> : No . MSK<0> : Then MSK<1> do . ",,1
65,65,65,65,65,65,65,65,65,65,65,65,65,1076.0,"How can you tell me I should exercise to lose weight? All you do is sit behind a desk all day. I've never seen you do a lick of exercise.  Identify the logical fallacy commited in this argument.",ad hominem,How can MSK<0> tell MSK<1> MSK<1> should MSK<2> to lose weight ? All MSK<0> do is sit behind a desk all day . MSK<0> 've never seen MSK<0> do a lick of MSK<2> . Identify the logical fallacy commited in this argument . ,,1
66,66,66,66,66,66,66,66,66,66,66,66,66,829.0,"I am voting for Smith for President. My whole family is Democrat, so I'll be voting that way, too.",ad populum,"MSK<0> am MSK<1> for Smith for President . MSK<0> whole family is Democrat , so MSK<0> 'll be MSK<1> that way , too . ",,1
67,67,67,67,67,67,67,67,67,67,67,67,67,2373.0,We must eliminate affirmative action. We can’t rely on laws to end racial prejudice.,fallacy of relevance,MSK<0> must eliminate affirmative action . MSK<0> ca n’t rely on laws to end racial prejudice . ,,1
68,68,68,68,68,68,68,68,68,68,68,68,68,2141.0,"Your honor, while my son may have made a bad decision that night while under the influence of alcohol, it shouldn't affect the rest of his life. It was just one mistake. He's on the varsity swim team.",intentional,"Your honor , while my son may have made a bad decision that night while under the influence of alcohol , MSK<0> shouldn't affect the rest of MSK<1> life . MSK<0> was just one mistake . MSK<1> 's on the varsity swim team . ",,1
69,69,69,69,69,69,69,69,69,69,69,69,69,2047.0,There is definitely a link between dementia and drinking energy drinks. I read about it on Wikipedia.,fallacy of credibility,There is definitely a link between MSK<0> and drinking energy drinks . I read about MSK<0> on Wikipedia . ,,1
70,70,70,70,70,70,70,70,70,70,70,70,70,1583.0,"When a statement falsely claims or assumes an ""either / or"" situation, when in fact there is at least one additional logically valid option, it is called...",false dilemma,"When MSK<0> falsely claims or assumes an "" either / or "" situation , when in fact there is at least one additional logically valid option , MSK<0> is called ... ",,1
71,71,71,71,71,71,71,71,71,71,71,71,71,2016.0,"Cocaine is all natural; therefore, it is good for you.",fallacy of credibility,"MSK<0> is all natural ; therefore , MSK<0> is good for you . ",,1
72,72,72,72,72,72,72,72,72,72,72,72,72,891.0,The Freehold Raceway Mall is the best mall because there are always so many cars there.,ad populum,The Freehold Raceway MSK<0> is the best MSK<0> because there are always so many cars there . ,,1
73,73,73,73,73,73,73,73,73,73,73,73,73,1872.0,SM 5: Argument regarding insanity as a defense against execution,fallacy of relevance,SM 5 : Argument regarding insanity as a defense against execution ,,1
74,74,74,74,74,74,74,74,74,74,74,74,74,2221.0,"A: The Government should enact minimum-wage legislation so that workers are not exploited. B: Nonsense. You say that only because you cannot find a good job.",ad hominem,A : The Government should enact minimum - wage legislation so that workers are not exploited . B : Nonsense . MSK<0> say that only because MSK<0> can not find a good job . ,,1
75,75,75,75,75,75,75,75,75,75,75,75,75,2113.0,If you buy the Disney annual pass you will save money when visiting the happiest place on Earth!,intentional,If MSK<0> buy the Disney annual pass MSK<0> will save money when visiting the happiest place on Earth ! ,,1
