Unnamed: 0.7,Unnamed: 0.6,Unnamed: 0.5,Unnamed: 0.4,Unnamed: 0.2,Unnamed: 0,Unnamed: 0.1,Unnamed: 0.1.1,Unnamed: 0.1.1.1,Unnamed: 0.1.1.1.1,Unnamed: 0.1.1.1.1.1,Unnamed: 0.1.1.1.1.1.1,Unnamed: 0.1.1.1.1.1.1.1,Unnamed: 0.1.1.1.1.1.1.1.1,source_article,updated_label,masked_articles,Unnamed: 0.3,is_fallacy 
626,626,626,626,326,326,326,326,326,326,326,328,1285,,FDR was a mighty engine pulling country out of desert of Great Depression,fallacy of logic,FDR was a mighty engine pulling country out of desert of Great Depression ,326.0,1
627,627,627,627,327,327,327,327,327,327,327,329,1740,,"Person A: I think pollution from humans contributes to climate change. Person B: So, you think humans are directly responsible for extreme weather, like hurricanes, and have caused the droughts in the southwestern U.S.?",fallacy of extension,"MSK<0> A : I MSK<1> pollution from MSK<2> contributes to MSK<3> change . MSK<0> B : So , you MSK<1> MSK<2> are directly responsible for extreme MSK<3> , like hurricanes , and have caused the droughts in the southwestern U.S. ? ",327.0,1
628,628,628,628,328,328,328,328,328,328,328,330,1671,,"But professor, I got all these facts from a program I saw on TV once... I don’t remember the name of it though.",equivocation,"But professor , MSK<0> got all these facts from MSK<1> MSK<0> saw on TV once ... MSK<0> do n’t remember the name of MSK<1> though . ",328.0,1
629,629,629,629,329,329,329,329,329,329,329,331,2134,,"Issue A has been raised, and adequately answered. Issue B is then raised, and adequately answered. ..... Issue Z is then raised, and adequately answered. (despite all issues adequately answered, the opponent refuses to conceded or accept the argument.",intentional,"MSK<0> A has been MSK<1> , and MSK<3> . MSK<0> B is then MSK<1> , and MSK<3> . .... . MSK<0> Z is then MSK<1> , and MSK<3> . ( despite all MSK<0> MSK<3> , the opponent refuses to conceded or accept the argument . ",329.0,1
630,630,630,630,330,330,330,330,330,330,330,332,1686,,"Student: You didn't teach us this; we never learned this.  Teacher: So, what you're saying is that you just didn't study it after we went over it in class right? That you don't want to put in the work?",fallacy of extension,"Student : MSK<0> didn't MSK<3> MSK<1> this ; MSK<1> never learned MSK<2> . MSK<3> : So , what MSK<0> 're saying is that MSK<0> just didn't study MSK<2> after MSK<1> went over MSK<2> in class right ? That MSK<0> don't want to put in the work ? ",330.0,1
631,631,631,631,331,331,331,331,331,331,331,333,73,,Look at people like Michael Vick and OJ Simpson. Professional athletes really have no sense of morality.,faulty generalization,Look at people like Michael Vick and OJ Simpson . Professional athletes really have no sense of morality . ,331.0,1
632,632,632,632,332,332,332,332,332,332,332,334,1350,,"All ghosts are imaginary. All unicorns are imaginary. Therefore, all ghosts are unicorns.",fallacy of logic,"MSK<0> are MSK<1> . All MSK<2> are MSK<1> . Therefore , MSK<0> are MSK<2> . ",332.0,1
633,633,633,633,333,333,333,333,333,333,333,335,1080,,"David is so wrong about Luna's work ethic. David is just an egotistical jerk with a God complex, what does he know?",ad hominem,"MSK<0> is so wrong about Luna 's work ethic . MSK<0> is just an egotistical jerk with a God complex , what does MSK<0> know ? ",333.0,1
634,634,634,634,334,334,334,334,334,334,334,336,529,,"Every sunrise, the rooster makes a sound. So it is the rooster which makes the sun rise.",false causality,"Every sunrise , MSK<0> makes a sound . So it is MSK<0> which makes the sun rise . ",334.0,1
635,635,635,635,335,335,335,335,335,335,335,337,337,,"President Obama’s decision to arm Syrian rebels, however meagerly, has all but doomed us to an Iraq-style debacle",faulty generalization,"President Obama ’s decision to arm Syrian rebels , however meagerly , has all but doomed us to an Iraq - style debacle ",335.0,1
636,636,636,636,336,336,336,336,336,336,336,338,544,,"My new sport psychology intervention works! I chose the player with the lowest batting average based on the last game from each of the teams in our amateur baseball league. Then I gave each of them my 5-minute intervention. And almost all of them improved their batting average in the next game!"" (Note: this example may also involve the statistical phenomenon of regression to the mean.",false causality,"MSK<0> works ! MSK<1> chose the player with MSK<2> based on the last MSK<3> from each of the teams in our amateur baseball league . Then MSK<1> gave each of MSK<4> MSK<0> . And almost all of MSK<4> improved MSK<2> in the next MSK<3> ! "" ( Note : MSK<0> may also involve the statistical phenomenon of regression to the mean . ",336.0,1
637,637,637,637,337,337,337,337,337,337,337,339,491,,"Earthquakes are caused when the plates of the Earth's crust move. Earthquakes happen along ""fault lines"" in the earth’s crust. When the plates in the Earth suddenly shift, the Earth will begin to shift, shake or tremble. What is the central idea?",false causality,"MSK<0> are caused when MSK<1> MSK<2> . MSK<0> happen along "" fault lines "" in MSK<2> crust . When MSK<1> MSK<2> suddenly MSK<3> , MSK<2> will begin to MSK<3> , shake or tremble . What is the central idea ? ",337.0,1
638,638,638,638,338,338,338,338,338,338,338,340,435,,You oversleep and then fail a test; so you assume that oversleeping causes you to fail tests,false causality,MSK<0> MSK<3> and then MSK<1> a MSK<2> ; so MSK<0> assume that MSK<3> causes MSK<0> to MSK<1> MSK<2> ,338.0,1
639,639,639,639,339,339,339,339,339,339,339,341,1759,,"Person 1: I think pollution from humans contributes to climate change.  Person 2: So, you think humans are directly responsible for extreme weather, like hurricanes, and have caused the droughts in the southwestern U.S.? If that’s the case, maybe we just need to go to the southwest and perform a “rain dance.”",fallacy of extension,"MSK<3> : I MSK<1> pollution from MSK<2> contributes to MSK<6> change . MSK<3> : So , you MSK<1> MSK<2> are directly responsible for extreme MSK<6> , like hurricanes , and have caused the droughts in the MSK<5> U.S. ? If that ’s the case , maybe we just need to go to the MSK<5> and perform a MSK<4> MSK<6> dance . MSK<4> ",339.0,1
640,640,640,640,340,340,340,340,340,340,340,342,810,,"Marcus wants to go to a small community college close to home, but most of the kids in his class are applying to larger colleges out of state. Marcus decides that he should also apply to those colleges.",ad populum,"MSK<0> wants to go to a small community college close to home , but most of the kids in MSK<0> class are MSK<1> to MSK<2> out of state . MSK<0> decides that MSK<0> should also MSK<1> to MSK<2> . ",340.0,1
641,641,641,641,341,341,341,341,341,341,341,343,755,,"the phrase ""Ninety percent of all people surveyed said that McDonalds is better than Burger King so it must be true.""  represents which fallacy?",ad populum,"the phrase "" Ninety percent of all people surveyed said that MSK<0> is better than Burger King so MSK<0> must be true . "" represents which fallacy ? ",341.0,1
642,642,642,642,342,342,342,342,342,342,342,344,767,,Millions of people drink Diet Coke every year so it must be the best soft drink in the world.,ad populum,Millions of people MSK<0> MSK<1> every year so MSK<1> must be the best soft MSK<0> in the world . ,342.0,1
643,643,643,643,343,343,343,343,343,343,343,345,418,,"Pointing to a fancy chart, Roger shows how temperatures have been rising over the past few centuries, whilst at the same time the numbers of pirates have been decreasing; thus pirates cool the world and global warming is a hoax.",false causality,"Pointing to a fancy chart , Roger shows how temperatures have been rising over the past few centuries , whilst at the same time the numbers of MSK<0> have been decreasing ; thus MSK<0> cool the world and global warming is a hoax . ",343.0,1
644,644,644,644,344,344,344,344,344,344,344,346,1675,,"""Senator Jones says that we should not fund the attack submarine program. I disagree entirely. I can't understand why he wants to leave us defenseless like that.""",fallacy of extension,""" MSK<0> says that MSK<1> should not fund the attack submarine program . MSK<0> disagree entirely . MSK<0> can't understand why he wants to leave MSK<1> defenseless like that . "" ",344.0,1
645,645,645,645,345,345,345,345,345,345,345,347,1109,,"This trick, which literally means ""to the guy,"" distorts a person's character subtly or blatantly, undermining their reputation regardless of how compelling their point is.",ad hominem,"This trick , which literally means "" to the guy , "" distorts MSK<0> character subtly or blatantly , undermining MSK<0> reputation regardless of how compelling MSK<0> point is . ",345.0,1
646,646,646,646,346,346,346,346,346,346,346,348,1553,,"Dad, either you let me go to the party or you're a bad dad.",false dilemma,"MSK<0> , either MSK<1> let me go to the party or MSK<1> 're a bad MSK<0> . ",346.0,1
647,647,647,647,347,347,347,347,347,347,347,349,2219,,"Most people believe in ghosts, so ghosts are real.",ad populum,"Most people believe in MSK<0> , so MSK<0> are real . ",347.0,1
648,648,648,648,348,348,348,348,348,348,348,350,1667,,"If you are open to it, love will find you.",equivocation,"If MSK<0> are open to it , love will find MSK<0> . ",348.0,1
649,649,649,649,349,349,349,349,349,349,349,351,2376,,"Education is important for the future of the American people and our country.   So, you should choose to study at St. Cloud State University.",fallacy of relevance,"Education is important for the future of the American people and our country . So , you should choose to study at St. Cloud State University . ",349.0,1
650,650,650,650,350,350,350,350,350,350,350,352,1212,,"Wilma: You cheated on your income tax. Don't you realize that's wrong? Walter: Hey, wait a minute. You cheated on your income tax last year. Or have you forgotten about that?",ad hominem,"MSK<0> : MSK<0> MSK<1> on MSK<2> . Don't MSK<0> realize that 's wrong ? Walter : Hey , wait a minute . MSK<0> MSK<1> on MSK<2> last year . Or have MSK<0> forgotten about that ? ",350.0,1
651,651,651,651,351,351,351,351,351,351,351,353,1825,,"When you are late getting home-past curfew-you distract your parents by talking to them about the weather-how cold it is, or how rainy it is.",fallacy of relevance,"When MSK<0> are late getting home - past curfew - MSK<0> distract MSK<0> by talking to coref1 about the weather - how cold MSK<1> is , or how rainy MSK<1> is . ",351.0,1
652,652,652,652,352,352,352,352,352,352,352,354,312,,"If we control Covid-19 with measures that are too draconian, we could wind up with a government that regularly clamps down on its citizens, with bar codes on wrists and cameras in your houses that watch you all the time.",faulty generalization,"If MSK<0> control MSK<1> with measures that are too draconian , MSK<0> could wind up with a government that regularly clamps down on MSK<1> citizens , with bar codes on wrists and cameras in your houses that watch you all the time . ",352.0,1
653,653,653,653,353,353,353,353,353,353,353,355,1642,,You are either with God or against him.,false dilemma,You are either with God or against him . ,353.0,1
654,654,654,654,354,354,354,354,354,354,354,356,787,,Everybody does it.  You should too.,ad populum,Everybody does it . You should too . ,354.0,1
655,655,655,655,355,355,355,355,355,355,355,357,2374,,"You call your cell phone provider to complain about how poor your cell phone battery life is after the recent software update. The representative, instead of responding to your concern, praises the provider’s new unlimited text-messaging plans that are due to be released in the next month.",fallacy of relevance,"MSK<0> call MSK<0> to complain about how poor MSK<0> cell phone battery life is after the recent software update . The representative , instead of responding to MSK<0> concern , praises coref1 new unlimited text - messaging plans that are due to be released in the next month . ",355.0,1
656,656,656,656,356,356,356,356,356,356,356,358,429,,"“Yesterday, I walked under a ladder with an open umbrella indoors while spilling salt in front of a black cat. And I forgot to knock on wood with my lucky dice. That must be why I’m having such a bad day today. It’s bad luck.”",false causality,"MSK<3> MSK<4> , MSK<0> walked under a ladder with an open umbrella indoors while spilling salt in front of a black cat . And MSK<0> forgot to knock on wood with MSK<0> MSK<5> dice . MSK<1> must be why MSK<0> ’m having such a MSK<2> day MSK<4> . MSK<1> ’s MSK<2> MSK<5> . MSK<3> ",356.0,1
657,657,657,657,357,357,357,357,357,357,357,359,1464,,a lifelong Republican who was against Obamacare until it saved his life.,appeal to emotion,a lifelong Republican who was against MSK<0> until it saved MSK<0> life . ,357.0,1
658,658,658,658,358,358,358,358,358,358,358,360,1136,,His opinions about sports mean nothing - he can barely tie his own shoes!,ad hominem,MSK<0> opinions about sports mean nothing - MSK<0> can barely tie MSK<0> own shoes ! ,358.0,1
659,659,659,659,359,359,359,359,359,359,359,361,1658,,I didn’t steal your pen—I borrowed it,equivocation,MSK<0> did n’t steal MSK<1> — MSK<0> borrowed MSK<1> ,359.0,1
660,660,660,660,360,360,360,360,360,360,360,362,598,,"America is the best place to live, because it's better than any other country.",circular reasoning,"MSK<0> is the best place to live , because MSK<0> 's better than any other country . ",360.0,1
661,661,661,661,361,361,361,361,361,361,361,363,728,,"After years of ignoring God, people have a hard time realizing what is right and what is wrong, what is good and what is bad.",circular reasoning,"After years of ignoring God , people have a hard time realizing what is right and what is wrong , what is good and what is bad . ",361.0,1
662,662,662,662,362,362,362,362,362,362,362,364,1155,,What can our new math teacher know? Have you seen how fat she is?,ad hominem,What can our new math teacher know ? Have you seen how fat she is ? ,362.0,1
663,663,663,663,363,363,363,363,363,363,363,365,1418,,A persuasive technique meant to influence a person’s emotions.,appeal to emotion,A persuasive technique meant to influence a person ’s emotions . ,363.0,1
664,664,664,664,364,364,364,364,364,364,364,366,2085,,"Saying that the burden of proof lies not with the person making the claim, but with someone else to disprove.",intentional,"Saying that the burden of proof lies not with the person making the claim , but with someone else to disprove . ",364.0,1
665,665,665,665,365,365,365,365,365,365,365,367,2068,,"There is no concrete proof that Duterte himself is corrupt; therefore, he is an honest politician.",intentional,"There is no concrete proof that MSK<0> is corrupt ; therefore , MSK<0> is an honest politician . ",365.0,1
666,666,666,666,366,366,366,366,366,366,366,368,2025,,"We should offer movies on our company’s website. REPLY: No, we’ve built our company’s fortune by renting movies only through our stores.",fallacy of credibility,"MSK<0> should offer MSK<1> on MSK<2> website . REPLY : No , MSK<0> ’ve built MSK<2> fortune by renting MSK<1> only through MSK<0> stores . ",366.0,1
667,667,667,667,367,367,367,367,367,367,367,369,1905,,Why shouldn't I gossip about Laura Jane? You know she talks about us every chance she gets.,fallacy of relevance,Why shouldn't I gossip about MSK<0> ? You know MSK<0> talks about us every chance MSK<0> gets . ,367.0,1
668,668,668,668,368,368,368,368,368,368,368,370,2106,,"SuperCyberDate.con determined that Sally and Billy are a great match because they both like pizza, movies, junk food, Janet Jackson, and vote republican.",intentional,"SuperCyberDate.con determined that Sally and Billy are a great match because they both like pizza , movies , junk food , Janet Jackson , and vote republican . ",368.0,1
669,669,669,669,369,369,369,369,369,369,369,371,1670,,"Willard: I just realized that I will probably never go bald! Fanny: Why is that? Willard:  Well, if I lose just one hair, I will not be bald, correct? Fanny: Of course. Willard: If I lose two hairs? Fanny: No. Willard: Every time I lose a hair, the loss of that one hair will not make me bald; therefore, I will never go bald. Fanny: Congratulations, you found the cure to baldness -- stupidity! ",equivocation,"MSK<0> : MSK<0> just realized that MSK<0> will probably never go MSK<1> ! MSK<2> : Why is that ? MSK<0> : Well , if MSK<0> MSK<3> just one MSK<4> , MSK<0> will not be MSK<1> , correct ? MSK<2> : Of course . MSK<0> : If MSK<0> MSK<3> two MSK<4> ? MSK<2> : No . MSK<0> : Every time MSK<0> MSK<3> MSK<5> , the MSK<3> of MSK<5> will not make MSK<0> MSK<1> ; therefore , MSK<0> will never go MSK<1> . MSK<2> : Congratulations , you found the cure to MSK<1> -- stupidity ! ",369.0,1
670,670,670,670,370,370,370,370,370,370,370,372,896,,"peer pressure, persuasion based on the the foundation that everybody’s doing it.",ad populum,"peer pressure , persuasion based on the the foundation that everybody ’s doing it . ",370.0,1
671,671,671,671,371,371,371,371,371,371,371,373,125,,A few students are misbehaving...therefore the whole class is bad. What fallacy is this an example of?,faulty generalization,A few students are misbehaving ... therefore the whole class is bad . What fallacy is this an example of ? ,371.0,1
672,672,672,672,372,372,372,372,372,372,372,374,256,,"“If we let teenagers wear whatever they want to school, they will no longer respect the rules and academic performance will decline.”",faulty generalization,"MSK<1> If we let MSK<0> wear whatever MSK<0> want to school , MSK<0> will no longer respect the rules and academic performance will decline . MSK<1> ",372.0,1
673,673,673,673,373,373,373,373,373,373,373,375,1088,,"TOPIC: Should people let their cats go outside? DEBATE: ""People should let their cats go outside. Going outside gives cats more exercise."" ""What do you know? You've never even had a pet cat before!""",ad hominem,"TOPIC : Should MSK<0> MSK<1> MSK<0> go MSK<2> ? DEBATE : "" coref2 should MSK<1> coref1 go MSK<2> . Going MSK<2> gives MSK<3> more exercise . "" "" What do MSK<4> know ? MSK<4> 've never even had a MSK<3> MSK<3> before ! "" ",373.0,1
674,674,674,674,374,374,374,374,374,374,374,376,112,,"Which rhetorical fallacy is a broad statement about people on the basis of gender, ethnicity, race, or political, social, professional, or religious group?",faulty generalization,"Which rhetorical fallacy is a broad statement about people on the basis of gender , ethnicity , race , or political , social , professional , or religious group ? ",374.0,1
675,675,675,675,375,375,375,375,375,375,375,377,2300,,"The anti-terrorist laws that monitor international currency transfers, phone calls, and emails are the first step to turning our fragile democracy into a new Nazi regime.",faulty generalization,"The anti-terrorist laws that monitor international currency transfers , phone calls , and emails are the first step to turning our fragile democracy into a new Nazi regime . ",375.0,1
676,676,676,676,376,376,376,376,376,376,376,378,1026,,"Don't listen to her even though she's a doctor. She isn't a good person, so her opinion is invalid.",ad hominem,"Don't listen to MSK<0> even though MSK<0> 's a doctor . MSK<0> isn't a good person , so MSK<0> opinion is invalid . ",376.0,1
677,677,677,677,377,377,377,377,377,377,377,379,2324,,"Millions of people are Marxists, so Marxist economic and political theories are  correct.",ad populum,"Millions of people are MSK<0> , so MSK<0> economic and political theories are correct . ",377.0,1
678,678,678,678,378,378,378,378,378,378,378,380,1024,,"""You haven't held a steady job since 1992. Worse than that, we couldn't find a single employer who'd provide you with a good reference.""",ad hominem,""" MSK<0> haven't held a steady job since 1992 . Worse than that , we couldn't find a single employer who 'd provide MSK<0> with a good reference . "" ",378.0,1
679,679,679,679,379,379,379,379,379,379,379,381,2391,,"No one has ever been able to prove that extraterrestrials do not exist, so they must be real.",intentional,"No one has ever been able to prove that MSK<0> do not exist , so MSK<0> must be real . ",379.0,1
680,680,680,680,380,380,380,380,380,380,380,382,2170,,Have you stopped cheating on exams?,intentional,Have you stopped cheating on exams ? ,380.0,1
681,681,681,681,381,381,381,381,381,381,381,383,2059,,"I'm not a doctor, but I play one on the hit series, ""Bimbos and Studmuffins in the OR."" You can take it from me that when you need a safe and effective pain killer, there is nothing better then MorphiPill 2000. That is my professional medical opinion.",fallacy of credibility,"MSK<0> 'm not a MSK<2> , but MSK<0> play one on the hit series , "" Bimbos and Studmuffins in the OR . "" MSK<1> can take it from MSK<0> that when MSK<1> need a safe and effective pain killer , there is nothing better then MorphiPill 2000 . That is MSK<0> professional MSK<2> opinion . ",381.0,1
682,682,682,682,382,382,382,382,382,382,382,384,1955,,"“We should abolish the death penalty. Many respected people, such as Imran Kader, have publicly stated their opposition to it.”",fallacy of credibility,"MSK<2> We should abolish MSK<0> . MSK<1> , have publicly stated MSK<1> opposition to MSK<0> . MSK<2> ",382.0,1
683,683,683,683,383,383,383,383,383,383,383,385,1769,,"The goal of people who ask us to wear masks to pure compliance, to practice controlling a witless population. We are not sheep!",fallacy of extension,"The goal of people who ask MSK<0> to wear masks to pure compliance , to practice controlling a witless population . MSK<0> are not sheep ! ",383.0,1
684,684,684,684,384,384,384,384,384,384,384,386,980,,"""Bernie Saunders wouldn't make a good president because he looks like a sad muppet.""",ad hominem,""" MSK<0> wouldn't make a good president because MSK<0> looks like a sad muppet . "" ",384.0,1
685,685,685,685,385,385,385,385,385,385,385,387,1452,,"Saying that you support a specific candidate for class president, only because he has recently been diagnosed with cancer is an example of which fallacy?",appeal to emotion,"Saying that you support MSK<0> , only because MSK<0> has recently been diagnosed with cancer is an example of which fallacy ? ",385.0,1
686,686,686,686,386,386,386,386,386,386,386,388,784,,"""How could you not believe in ghosts? Roughly two billon people believe in them, so don't you think you should reconsider your opinion?""",ad populum,""" How could MSK<0> not MSK<1> in ghosts ? Roughly MSK<2> MSK<1> in MSK<2> , so don't MSK<0> think MSK<0> should reconsider MSK<0> opinion ? "" ",386.0,1
687,687,687,687,387,387,387,387,387,387,387,389,126,,"Three kids in one class failed the Jane Eyre quiz, I guess,all the other classes will all fail it, too.",faulty generalization,"Three kids in one MSK<0> MSK<2> , I guess , all the other MSK<0> will all MSK<2> , too . ",387.0,1
688,688,688,688,388,388,388,388,388,388,388,390,1158,,Dr. Bloom cannot be a competent marriage counselor because he is divorced.,ad hominem,MSK<0> can not be a competent marriage counselor because MSK<0> is divorced . ,388.0,1
689,689,689,689,389,389,389,389,389,389,389,391,2388,,"Everyone should be patient and wait for his or her turn in line. However, I need to go to the front because I am late for an appointment.",intentional,"MSK<0> should be patient and wait for his or MSK<0> turn in line . However , MSK<1> need to go to the front because MSK<1> am late for an appointment . ",389.0,1
690,690,690,690,390,390,390,390,390,390,390,392,2019,,"Argues that ""we've always done it that way."" In other words, because something worked in the past, it is the correct thing to do.",fallacy of credibility,"Argues that "" we 've always done it that way . "" In other words , because MSK<0> worked in the past , MSK<0> is the correct thing to do . ",390.0,1
691,691,691,691,391,391,391,391,391,391,391,393,1829,,"Mom: You used up all of the data on our phone plan this month! Kid: I had a math test today that was really, really hard. Can you just forgive me this one time?",fallacy of relevance,"Mom : MSK<0> used up all of the data on our phone plan this month ! Kid : MSK<1> had a math test today that was really , really hard . Can MSK<0> just forgive MSK<1> this one time ? ",391.0,1
692,692,692,692,392,392,392,392,392,392,392,394,494,,"Jason and his family are heading to Utah to spend a week skiing. Looking at the weather reports, he notices that it is supposed to be warmer, making for lousy ski conditions. Angrily, he calls the Weather Channel and demands that they change their forecast so he will have better weather for the trip.",false causality,"MSK<0> and MSK<0> family are heading to Utah to spend a week MSK<3> . Looking at the MSK<1> reports , MSK<0> notices that it is supposed to be warmer , making for lousy MSK<3> conditions . Angrily , MSK<0> calls the MSK<1> Channel and demands that MSK<2> change MSK<2> forecast so MSK<0> will have better MSK<1> for the trip . ",392.0,1
693,693,693,693,393,393,393,393,393,393,393,395,481,,"Cellphones weren’t invented before I was born. Now, they are everywhere! Therefore, cellphones were created because I was born.",false causality,"MSK<0> were n’t invented before MSK<1> was MSK<2> . Now , MSK<0> are everywhere ! Therefore , cellphones were created because MSK<1> was MSK<2> . ",393.0,1
694,694,694,694,394,394,394,394,394,394,394,396,916,,AttP 3: Shirley MacLaine selling copies to many people makes her topic of choice true.,ad populum,AttP 3 : MSK<0> selling copies to many people makes MSK<0> topic of choice true . ,394.0,1
695,695,695,695,395,395,395,395,395,395,395,397,1051,,"The CEO of that company hates the environment, so I hate him and won’t buy their products.",ad hominem,"MSK<0> MSK<1> the environment , so MSK<0> MSK<1> MSK<0> and wo n’t buy MSK<0> products . ",395.0,1
