Unnamed: 0.7,Unnamed: 0.6,Unnamed: 0.5,Unnamed: 0.4,Unnamed: 0.2,Unnamed: 0,Unnamed: 0.1,Unnamed: 0.1.1,Unnamed: 0.1.1.1,Unnamed: 0.1.1.1.1,Unnamed: 0.1.1.1.1.1,Unnamed: 0.1.1.1.1.1.1,Unnamed: 0.1.1.1.1.1.1.1,Unnamed: 0.1.1.1.1.1.1.1.1,source_article,updated_label,masked_articles,Unnamed: 0.3,is_fallacy 
1270,1270,1270,1270,970,970,970,970,970,970,970,973,903,,"During class, Alex whispers to Jeff, ""More than 80% of university professors are voting against the Republicans. Clearly, it's the only intelligent vote to make.""",ad populum,"During class , Alex whispers to Jeff , "" More than 80 % of university professors are MSK<0> against the Republicans . Clearly , it 's the only intelligent MSK<0> to make . "" ",970.0,1
1271,1271,1271,1271,971,971,971,971,971,971,971,974,1593,,"Growing up, many children are told to eat their dinner or else they would never grow big and tall. What fallacy is this?",false dilemma,"MSK<0> up , MSK<1> are told to eat MSK<1> dinner or else MSK<1> would never MSK<0> big and tall . What fallacy is this ? ",971.0,1
1272,1272,1272,1272,972,972,972,972,972,972,972,975,759,,"Everyone seems to support the changes in the vacation policy, and if everyone likes them, they must be good.",ad populum,"MSK<0> seems to support MSK<1> , and if MSK<0> likes MSK<1> , MSK<1> must be good . ",972.0,1
1273,1273,1273,1273,973,973,973,973,973,973,973,976,987,,"If someone told you, ""Kyra doesn't know anything about science because she likes weird music,"" what logical fallacy are they using?",ad hominem,"If someone told MSK<0> , "" MSK<0> doesn't know anything about science because MSK<0> likes weird music , "" what logical fallacy are they using ? ",973.0,1
1274,1274,1274,1274,974,974,974,974,974,974,974,977,410,,"Global chocolate consumption is highest in Switzerland, yet people there are among the trimmest in the industrialized world. Therefore, it's reasonable to conclude that chocolate helps keep your weight down.",false causality,"Global MSK<0> consumption is highest in Switzerland , yet people there are among the trimmest in the industrialized world . Therefore , it 's reasonable to conclude that MSK<0> helps keep your weight down . ",974.0,1
1275,1275,1275,1275,975,975,975,975,975,975,975,978,2440,,"The fallacy of equivocation occurs when a key term or phrase in an argument is used in an ambiguous way, with one meaning in one portion of the argument and then another meaning in another portion of the argument.",equivocation,"The fallacy of equivocation occurs when a key term or phrase in coref1 is used in an ambiguous way , with one MSK<0> in MSK<1> and then another MSK<0> in MSK<1> . ",975.0,1
1276,1276,1276,1276,976,976,976,976,976,976,976,979,302,,one thing leads to another and another and another. . . creates a “snowball” effect.,faulty generalization,one thing leads to another and another and another . . . creates a “ snowball ” effect . ,976.0,1
1277,1277,1277,1277,977,977,977,977,977,977,977,980,253,,"If I don't take the right classes in high school, then I won't be able to get into a good college. If I don't get into a good college, then I won't be able to get a job. If I can't get a job, then I am going to end up homeless.",faulty generalization,"If MSK<0> don't take the right classes in high school , then MSK<0> won't be MSK<1> to get into MSK<2> . If MSK<0> don't get into MSK<2> , then MSK<0> won't be MSK<1> to get MSK<3> . If MSK<0> can't get MSK<3> , then MSK<0> am going to end up homeless . ",977.0,1
1278,1278,1278,1278,978,978,978,978,978,978,978,981,249,,This fallacy suggests that unlikely or ridiculous outcomes are likely when there’s just not enough evidence to think so.,faulty generalization,This fallacy suggests that unlikely or ridiculous outcomes are likely when there ’s just not enough evidence to think so . ,978.0,1
1279,1279,1279,1279,979,979,979,979,979,979,979,982,1874,,Warning!  Smoking may cause frostbite?,fallacy of relevance,Warning ! Smoking may cause frostbite ? ,979.0,1
1280,1280,1280,1280,980,980,980,980,980,980,980,983,2177,,"Don: If you drink alcohol, it will kill any virus you might have. Tony: What evidence do you have to support that?  Don: I don’t need evidence. It is common sense. ",intentional,"MSK<0> : If MSK<0> drink alcohol , it will kill any virus MSK<0> might have . Tony : What MSK<1> do MSK<0> have to support that ? MSK<0> : MSK<0> do n’t need MSK<1> . It is common sense . ",980.0,1
1281,1281,1281,1281,981,981,981,981,981,981,981,984,2193,,"""A person apparently hopelessly ill may be allowed to take his own life. Then he may be permitted to deputize others to do it for him should he no longer be able to act. The judgment of others then becomes the ruling factor. Already at this point euthanasia is not personal and voluntary, for others are acting on behalf of the patient as they see fit. This may well incline them to act on behalf of other patients who have not authorized them to exercise their judgment. It is only a short step, then, from voluntary euthanasia (self-inflicted or authorized), to directed euthanasia administered to a patient who has given no authorization, to involuntary euthanasia conducted as a part of a social policy.""",faulty generalization,""" MSK<0> may be allowed to take MSK<0> own life . Then MSK<0> may be permitted to deputize others to do it for MSK<0> should MSK<0> no longer be able to MSK<1> . The MSK<2> of others then becomes the ruling factor . Already at this point MSK<3> is not personal and MSK<4> , for others are MSK<1> on MSK<5> of the MSK<6> as MSK<7> see fit . This may well incline MSK<7> to MSK<1> on MSK<5> of other MSK<6> who have not MSK<8> MSK<7> to exercise MSK<7> MSK<2> . It is only a short step , then , from MSK<4> MSK<3> ( self - inflicted or MSK<8> ) , to directed MSK<3> administered to a MSK<6> who has given no MSK<8> , to involuntary MSK<3> conducted as a part of a social policy . "" ",981.0,1
1282,1282,1282,1282,982,982,982,982,982,982,982,985,393,,President Petutti ordered a military strike that killed many civilians. He is no different than any other mass murder and he belongs in prison!,faulty generalization,MSK<0> ordered a MSK<1> strike that killed many MSK<1> . MSK<0> is no different than any other mass murder and MSK<0> belongs in prison ! ,982.0,1
1283,1283,1283,1283,983,983,983,983,983,983,983,986,1742,,Students tell Ms. Higgins her hair color looks different on her. Ms. Higgins can't believe her students called ugly and horrendous to look at.,fallacy of extension,coref1 tell MSK<0> MSK<0> hair color MSK<1> different on MSK<0> . MSK<0> can't believe MSK<0> called ugly and horrendous to MSK<1> at . ,983.0,1
1284,1284,1284,1284,984,984,984,984,984,984,984,987,1879,,You want me to clean my locker? I think I left my homework in Science class. I need to keep up with my homework to get good grades.,fallacy of relevance,You want MSK<0> to clean MSK<0> locker ? MSK<0> think MSK<0> left MSK<1> in Science class . MSK<0> need to keep up with MSK<1> to get good grades . ,984.0,1
1285,1285,1285,1285,985,985,985,985,985,985,985,988,958,,"Shamus pointed a drunken finger at Sean and asked him to explain how so many people could believe in leprechauns if they're only a silly old superstition. Sean, however, had had a few too many Guinness himself and fell off his chair.",ad populum,"MSK<0> pointed a drunken finger at MSK<1> and asked MSK<0> to explain how so many MSK<2> could believe in leprechauns if MSK<2> 're only a silly old superstition . MSK<1> , however , had had a few too many Guinness MSK<1> and fell off MSK<1> chair . ",985.0,1
1286,1286,1286,1286,986,986,986,986,986,986,986,989,88,,"Sarah loves to wear running shoes, all girls must like to run.",faulty generalization,"Sarah loves to wear MSK<0> shoes , all girls must like to MSK<0> . ",986.0,1
1287,1287,1287,1287,987,987,987,987,987,987,987,990,1266,,"Since a single human cell becomes a grown man over a period of a few years, then surely it can't be impossible for a single-cell organism to become the human race over a period of several million years.",fallacy of logic,"Since MSK<0> becomes a grown man over a MSK<1> of a few MSK<2> , then surely MSK<0> can't be impossible for a single - cell organism to become the human race over a MSK<1> of several million MSK<2> . ",987.0,1
1288,1288,1288,1288,988,988,988,988,988,988,988,991,2152,,Have you stopped cheating on your tests?,intentional,Have MSK<0> stopped cheating on MSK<0> tests ? ,988.0,1
1289,1289,1289,1289,989,989,989,989,989,989,989,992,736,,smoking cigarettes is deadly because cigarettes can kill you,circular reasoning,MSK<0> MSK<0> is deadly because MSK<0> can kill you ,989.0,1
1290,1290,1290,1290,990,990,990,990,990,990,990,993,910,,You should listen to Ellie Goulding because everyone is listening to her music.,ad populum,You should MSK<0> to MSK<1> because everyone is MSK<0> to MSK<1> music . ,990.0,1
1291,1291,1291,1291,991,991,991,991,991,991,991,994,989,,"Oh, please. What would you know about labor laws? You don't even have a job.",ad hominem,"Oh , please . What would MSK<0> know about labor laws ? MSK<0> don't even have a job . ",991.0,1
1292,1292,1292,1292,992,992,992,992,992,992,992,995,782,,"X is popular; therefore, X is right.",ad populum,"MSK<0> is popular ; therefore , MSK<0> is right . ",992.0,1
1293,1293,1293,1293,993,993,993,993,993,993,993,996,1373,,"I know you don't like the cat sweater that Grandma knitted for you, but she worked so hard on it, and it will make her happy to see you wear it in the family holiday photo.",appeal to emotion,"I know MSK<0> don't like the cat sweater that Grandma knitted for MSK<0> , but MSK<1> worked so hard on MSK<2> , and MSK<2> will make MSK<1> happy to see MSK<0> wear MSK<2> in the family holiday photo . ",993.0,1
1294,1294,1294,1294,994,994,994,994,994,994,994,997,1537,,"Sukaina to her mom: Either you buy me this new book, or you decide that reading is not important at all.",false dilemma,"MSK<0> to MSK<0> mom : Either MSK<1> buy MSK<0> this new book , or MSK<1> decide that reading is not important at all . ",994.0,1
1295,1295,1295,1295,995,995,995,995,995,995,995,998,2191,,"If we legalize pot, the next thing you know people will want to legalize meth and heroin.",faulty generalization,"If we MSK<0> pot , the next thing you know people will want to MSK<0> meth and heroin . ",995.0,1
1296,1296,1296,1296,996,996,996,996,996,996,996,999,250,,"""Our planet is going to be destroyed! People are creating too much waste, the temperature will continue to rise, natural disasters will occur more frequently, the animals will starve to death, and the planet will basically turn into Venus!""",faulty generalization,""" MSK<0> is going to be destroyed ! People are creating too much waste , the temperature will continue to rise , natural disasters will occur more frequently , the animals will starve to death , and MSK<0> will basically turn into Venus ! "" ",996.0,1
1297,1297,1297,1297,997,997,997,997,997,997,997,1000,99,,"""The two courses I took at UWI were not very interesting. I don't think its a good university.""",faulty generalization,""" The two courses MSK<0> took at UWI were not very interesting . MSK<0> don't think its a good university . "" ",997.0,1
1298,1298,1298,1298,998,998,998,998,998,998,998,1001,1776,,"You support capital punishment just because you want an “eye for an eye,” but I have several good reasons to believe that capital punishment is fundamentally wrong.",fallacy of extension,"MSK<0> support MSK<1> just because MSK<0> want an MSK<3> MSK<2> for an MSK<2> , MSK<3> but I have several good reasons to believe that MSK<1> is fundamentally wrong . ",998.0,1
1299,1299,1299,1299,999,999,999,999,999,999,999,1002,2060,,"""The logic teacher was hired to fill the new computer animation class. He is a great admirer of Pixar's work and will do a great job.""",fallacy of credibility,""" MSK<0> was hired to fill the new computer animation class . MSK<0> is a MSK<1> admirer of Pixar 's MSK<2> and will do a MSK<1> MSK<2> . "" ",999.0,1
1300,1300,1300,1300,1000,1000,1000,1000,1000,1000,1000,1003,2194,,"""I think that the use of marijuana as a medical treatment shouldn't even be considered. If we make drugs legal in a few cases, then we might eventually have to completely legalize them - which is even crazier than Proposition 215. If we want to help people out by letting them do illegal things, then let's just get rid of all our laws.""",faulty generalization,""" I think that the use of MSK<4> as a medical treatment shouldn't even be considered . If MSK<0> make MSK<4> MSK<3> in a few cases , then MSK<0> might eventually have to completely legalize MSK<1> - which is even crazier than Proposition 215 . If MSK<0> want to help people out by MSK<2> MSK<1> do MSK<3> things , then MSK<2> MSK<0> just get rid of all MSK<0> laws . "" ",1000.0,1
1301,1301,1301,1301,1001,1001,1001,1001,1001,1001,1001,1004,1477,,"Claiming that ""If you elect him, the Dow Jones will tumble and you will lose all of your money!"" is an example of:",appeal to emotion,"Claiming that "" If MSK<0> elect him , the Dow Jones will tumble and MSK<0> will lose all of MSK<0> money ! "" is an example of : ",1001.0,1
1302,1302,1302,1302,1002,1002,1002,1002,1002,1002,1002,1005,2195,,"""There is ... a radical element, a homosexual agenda that wants to redefine what marriage is. They want to say that a marriage not only is one man and one woman but it is two men or it is two women. What logical reason is there to keep us from stopping expansion of that definition to include three people or an adult and a child, or any other odd combination that we want to have?  ... and it does not even have to be limited to human beings by the way. I mean it could be anything. ... There is no reason why we cannot just completely erase whatever boundaries that currently exist on the definition of marriage and say it is a free-for-all, anything goes.""",faulty generalization,""" There is MSK<0> a radical element , a homosexual agenda that MSK<1> to redefine what marriage is . They MSK<1> to say that MSK<2> not only is one MSK<3> and one MSK<4> but MSK<2> is two MSK<3> or MSK<2> is two MSK<4> . What logical MSK<5> is there to keep us from stopping expansion of that definition to include three people or an adult and a child , or any other odd combination that MSK<6> MSK<1> to have ? MSK<0> and MSK<2> does not even have to be limited to human beings by the way . I mean MSK<2> could be anything . MSK<0> There is no MSK<5> why MSK<6> can not just completely erase whatever boundaries that currently exist on MSK<7> and say MSK<7> is a free - for - all , anything goes . "" ",1002.0,1
1303,1303,1303,1303,1003,1003,1003,1003,1003,1003,1003,1006,1410,,Joe is firm in his principles. The reader admires Joe for not changing his ideas and opinions according to what is popular or advantageous.,appeal to emotion,MSK<0> is firm in MSK<0> principles . MSK<0> admires MSK<0> for not changing MSK<0> ideas and opinions according to what is popular or advantageous . ,1003.0,1
1304,1304,1304,1304,1004,1004,1004,1004,1004,1004,1004,1007,1078,,Vote for me because the other candidate is a cheat and a liar!,ad hominem,Vote for me because the other candidate is a cheat and a liar ! ,1004.0,1
1305,1305,1305,1305,1005,1005,1005,1005,1005,1005,1005,1008,1086,,"""I knew him in high school and he almost flunked out. He can't be a good choice for mayor.""",ad hominem,""" I knew MSK<0> in high school and MSK<0> almost flunked out . MSK<0> can't be a good choice for mayor . "" ",1005.0,1
1306,1306,1306,1306,1006,1006,1006,1006,1006,1006,1006,1009,1034,,"Charlie: Fast food is filled with salt, fat and added sugars. We need better regulation of the industry. Bob: That may be, but you're such a hypocrite! I saw you devour a Triple-Baconator, super-sized fries and 64 ounces of soda yesterday.",ad hominem,"Charlie : Fast food is filled with salt , fat and added sugars . We need better regulation of the industry . MSK<0> : That may be , but MSK<0> 're such a hypocrite ! MSK<0> saw MSK<0> devour a Triple - Baconator , super-sized fries and 64 ounces of soda yesterday . ",1006.0,1
1307,1307,1307,1307,1007,1007,1007,1007,1007,1007,1007,1010,1300,,"If I eat fast food for dinner, then I have a stomach ache in the evening. I had a stomach ache this evening. Therefore I ate fast food for dinner.",fallacy of logic,"If MSK<0> MSK<3> for MSK<4> , then MSK<0> have a MSK<6> in MSK<7> . MSK<0> had a MSK<6> MSK<7> . Therefore MSK<0> MSK<3> for MSK<4> . ",1007.0,1
1308,1308,1308,1308,1008,1008,1008,1008,1008,1008,1008,1011,193,,Democrats are gay and Republicans are rich.,faulty generalization,MSK<0> are gay and MSK<0> are rich . ,1008.0,1
1309,1309,1309,1309,1009,1009,1009,1009,1009,1009,1009,1012,2267,,"What I object to most about those people who oppose capital punishment is that they believe that the lives of convicted murderers are more important than the lives of the police and prison guards who protect us. But, obviously, since the lives of those who protect us are of the greatest value, no one should oppose capital punishment.",fallacy of extension,"What I object to most about those people who MSK<2> is that they believe that the MSK<3> of MSK<6> murderers are more important than the MSK<3> of the police and MSK<6> guards who MSK<5> . But , obviously , since the MSK<3> of those who MSK<5> are of the greatest value , no one should MSK<2> . ",1009.0,1
1310,1310,1310,1310,1010,1010,1010,1010,1010,1010,1010,1013,1870,,"Ashley: It is morally wrong to cheat on your spouse; why on earth would you have done that? Hannah: But what is morality exactly? Ashley: It’s a code of conduct shared by cultures. Hannah: But who creates this code?... Hannah has committed what fallacy?",fallacy of relevance,MSK<0> : It is morally wrong to cheat on MSK<1> spouse ; why on earth would MSK<1> have done that ? MSK<2> : But what is MSK<3> exactly ? MSK<0> : MSK<3> ’s a MSK<4> of conduct shared by cultures . MSK<2> : But who creates this MSK<4> ? ... MSK<2> has committed what fallacy ? ,1010.0,1
1311,1311,1311,1311,1011,1011,1011,1011,1011,1011,1011,1014,504,,I bought new shoes then my head started itching. I must be allergic to the shoes.,false causality,MSK<0> bought new MSK<1> then MSK<0> head started itching . MSK<0> must be allergic to the MSK<1> . ,1011.0,1
1312,1312,1312,1312,1012,1012,1012,1012,1012,1012,1012,1015,1973,,An attempt to gain a customer’s trust in an advertisement is referred to as,fallacy of credibility,An attempt to gain a customer ’s trust in an advertisement is referred to as ,1012.0,1
1313,1313,1313,1313,1013,1013,1013,1013,1013,1013,1013,1016,1652,,"The police said they suspect several people of setting the fire. Therefore, I can't be under suspicion because I was alone all night.",equivocation,"MSK<0> said MSK<0> MSK<2> several people of setting the fire . Therefore , MSK<1> can't be under MSK<2> because MSK<1> was alone all night . ",1013.0,1
1314,1314,1314,1314,1014,1014,1014,1014,1014,1014,1014,1017,116,,I saw that dog eat chicken so all dogs must only eat chicken.,faulty generalization,I saw that MSK<0> MSK<2> so all MSK<0> must only MSK<2> . ,1014.0,1
1315,1315,1315,1315,1015,1015,1015,1015,1015,1015,1015,1018,434,,"Every time I go to sleep, the sun goes down. Therefore, my going to sleep causes the sun to set.",false causality,"Every time MSK<0> go to MSK<1> , MSK<2> goes down . Therefore , MSK<0> going to MSK<1> causes MSK<2> to set . ",1015.0,1
1316,1316,1316,1316,1016,1016,1016,1016,1016,1016,1016,1019,2079,,"Bill: ""I think that some people have psychic powers.""  Jill: ""What is your proof?""  Bill: ""No one has been able to prove that people do not have psychic powers.""",intentional,"MSK<0> : "" MSK<0> think that some MSK<1> have MSK<3> . "" MSK<4> : "" What is MSK<4> MSK<5> ? "" MSK<0> : "" No one has been able to MSK<5> that MSK<1> do not have MSK<3> . "" ",1016.0,1
1317,1317,1317,1317,1017,1017,1017,1017,1017,1017,1017,1020,443,,"Alley ate a slice of pizza for dinner and a few hours later she had a fever. Therefore, pizza causes fevers.",false causality,"MSK<0> ate a slice of MSK<1> for dinner and a few hours later MSK<0> had a MSK<2> . Therefore , MSK<1> causes MSK<2> . ",1017.0,1
1318,1318,1318,1318,1018,1018,1018,1018,1018,1018,1018,1021,1069,,"""You're clearly just too young to understand what’s happening.” The statement is an example of…",ad hominem,""" You 're clearly just too young to understand what ’s happening . ” The statement is an example of … ",1018.0,1
1319,1319,1319,1319,1019,1019,1019,1019,1019,1019,1019,1022,745,,The Bible is the Word of God because God tells us it is... in the Bible.,circular reasoning,MSK<0> is the Word of MSK<1> because MSK<1> tells us MSK<0> is ... in MSK<0> . ,1019.0,1
1320,1320,1320,1320,1020,1020,1020,1020,1020,1020,1020,1023,526,,"""A solar flare erupted from the sun three days ago, and my laptop died this morning. Solar flares are very dangerous for computers.""",false causality,""" A MSK<0> MSK<1> erupted from the MSK<0> three days ago , and my MSK<2> died this morning . MSK<0> MSK<1> are very dangerous for MSK<2> . "" ",1020.0,1
1321,1321,1321,1321,1021,1021,1021,1021,1021,1021,1021,1024,1839,,"There is a lot of commotion regarding saving the environment. We simply cannot make this world into the Garden of Eden. Pursuing perfection is impossible and pointless. And besides, even Adam and Eve got bored in Eden!",fallacy of relevance,"There is a lot of commotion regarding saving the environment . We simply can not make this world into the Garden of MSK<0> . Pursuing perfection is impossible and pointless . And besides , even Adam and Eve got bored in MSK<0> ! ",1021.0,1
1322,1322,1322,1322,1022,1022,1022,1022,1022,1022,1022,1025,1409,,"The uncommunicative strangers seemed unwilling to speak to us, hiding behind the language barrier.",appeal to emotion,"The uncommunicative strangers seemed unwilling to speak to us , hiding behind the language barrier . ",1022.0,1
1323,1323,1323,1323,1023,1023,1023,1023,1023,1023,1023,1026,1351,,"The lady in the pink dress is Julia Roberts. The reporter thinks Julia Roberts drives a Prius. Therefore, the reporter thinks the lady in the pink dress drives a Prius.",fallacy of logic,"MSK<0> is MSK<1> . MSK<3> MSK<1> MSK<5> . Therefore , MSK<3> MSK<0> in coref3 MSK<5> . ",1023.0,1
1324,1324,1324,1324,1024,1024,1024,1024,1024,1024,1024,1027,206,,"Everybody understands that the values in New York City are socially liberal and pro-abortion and pro-gay marriage,' he said. 'And focus on money and the media.",faulty generalization,"Everybody understands that the values in New York City are socially liberal and MSK<0> and MSK<0> MSK<0> , ' he said . ' And focus on money and the media . ",1024.0,1
1325,1325,1325,1325,1025,1025,1025,1025,1025,1025,1025,1028,1439,,"By rejecting God, you are rejecting goodness, kindness, and love itself.",appeal to emotion,"By MSK<0> God , you are MSK<0> goodness , MSK<1> , and love MSK<1> . ",1025.0,1
1326,1326,1326,1326,1026,1026,1026,1026,1026,1026,1026,1029,53,,news organizations are Fake News?,faulty generalization,MSK<0> organizations are Fake MSK<0> ? ,1026.0,1
1327,1327,1327,1327,1027,1027,1027,1027,1027,1027,1027,1030,2002,,Not able to defend his position that evolution 'isn't true' Bob says that he knows a scientist who also questions evolution (and presumably isn't a primate).,fallacy of credibility,Not able to defend MSK<0> position that MSK<1> ' isn't true ' MSK<0> says that MSK<0> knows a scientist who also questions MSK<1> ( and presumably isn't a primate ) . ,1027.0,1
1328,1328,1328,1328,1028,1028,1028,1028,1028,1028,1028,1031,2424,,"Q: Did the President have an affair? A: ""He's very busy at the moment with the Middle East Peace talks, and has no time for  silly accusations."" ",fallacy of relevance,"Q : Did MSK<0> have an affair ? A : "" MSK<0> 's very busy at the moment with the Middle East Peace talks , and has no time for silly accusations . "" ",1028.0,1
1329,1329,1329,1329,1029,1029,1029,1029,1029,1029,1029,1032,132,,"My parents are vegetarians, and they are good people. Therefore, all vegetarians must be good people.",faulty generalization,"MSK<0> are MSK<1> , and MSK<0> are MSK<3> . Therefore , all MSK<1> must be MSK<3> . ",1029.0,1
1330,1330,1330,1330,1030,1030,1030,1030,1030,1030,1030,1033,1401,,present ideas that elicit strong feelings,appeal to emotion,present ideas that elicit strong feelings ,1030.0,1
1331,1331,1331,1331,1031,1031,1031,1031,1031,1031,1031,1034,1820,,"So many people are speaking up about animal rights, but what they should first focus on is human rights.",fallacy of relevance,"So MSK<0> are speaking up about animal MSK<1> , but what MSK<0> should first focus on is human MSK<1> . ",1031.0,1
1332,1332,1332,1332,1032,1032,1032,1032,1032,1032,1032,1035,682,,You can't give me a C. I'm an A student.,circular reasoning,You can't give MSK<0> a C. MSK<0> 'm an A student . ,1032.0,1
1333,1333,1333,1333,1033,1033,1033,1033,1033,1033,1033,1036,1883,,You say that Coach Smith pressured teachers to give his students passing grades. But don’t you agree that athletics are important to schools? Don’t they build character?,fallacy of relevance,MSK<0> say that MSK<1> pressured teachers to give MSK<1> students passing grades . But do n’t MSK<0> agree that MSK<2> are important to schools ? Do n’t MSK<2> build character ? ,1033.0,1
1334,1334,1334,1334,1034,1034,1034,1034,1034,1034,1034,1037,1332,,"Nuclear disarmament is a risk, but everything in life involves a risk. Every time you drive in a car you are taking a risk. If you're willing to drive in a car, you should be willing to have disarmament.",fallacy of logic,"Nuclear MSK<0> is a risk , but everything in life involves MSK<1> . Every time MSK<2> MSK<3> in a MSK<4> MSK<2> are taking MSK<1> . If MSK<2> 're MSK<5> to MSK<3> in a MSK<4> , MSK<2> should be MSK<5> to have MSK<0> . ",1034.0,1
